ffff8800b0bfc840 3539039961 S Ci:1:001:0 s a3 00 0000 0001 0004 4 <
ffff8800b0bfc840 3539039978 C Ci:1:001:0 0 4 = 00010000
ffff8800b0bfc840 3539039985 S Ci:1:001:0 s a3 00 0000 0002 0004 4 <
ffff8800b0bfc840 3539039990 C Ci:1:001:0 0 4 = 00010000
ffff8800b0bfc840 3539039994 S Ci:1:001:0 s a3 00 0000 0003 0004 4 <
ffff8800b0bfc840 3539039998 C Ci:1:001:0 0 4 = 00010000
ffff8800b0bfc840 3539040002 S Ci:1:001:0 s a3 00 0000 0004 0004 4 <
ffff8800b0bfc840 3539040009 C Ci:1:001:0 0 4 = 00010000
ffff8800b0bfc840 3539040012 S Ci:1:001:0 s a3 00 0000 0005 0004 4 <
ffff8800b0bfc840 3539040023 C Ci:1:001:0 0 4 = 01050100
ffff8800b0bfc840 3539040030 S Co:1:001:0 s 23 01 0010 0005 0000 0
ffff8800b0bfc840 3539040035 C Co:1:001:0 0 0
ffff8800b0bfc840 3539040038 S Ci:1:001:0 s a3 00 0000 0006 0004 4 <
ffff8800b0bfc840 3539040042 C Ci:1:001:0 0 4 = 00010000
ffff8800b0bfc840 3539040045 S Ci:1:001:0 s a3 00 0000 0007 0004 4 <
ffff8800b0bfc840 3539040049 C Ci:1:001:0 0 4 = 00010000
ffff8800b0bfc840 3539040052 S Ci:1:001:0 s a3 00 0000 0008 0004 4 <
ffff8800b0bfc840 3539040056 C Ci:1:001:0 0 4 = 00010000
ffff88013587f780 3539143959 S Ii:1:001:1 -115:2048 4 <
ffff8800b0bfc840 3539143978 S Ci:1:001:0 s a3 00 0000 0005 0004 4 <
ffff8800b0bfc840 3539143986 C Ci:1:001:0 0 4 = 01050000
ffff8800b0bfc840 3539144001 S Co:1:001:0 s 23 03 0004 0005 0000 0
ffff8800b0bfc840 3539144008 C Co:1:001:0 0 0
ffff880135b99f00 3539199952 S Ci:1:001:0 s a3 00 0000 0005 0004 4 <
ffff880135b99f00 3539200156 C Ci:1:001:0 0 4 = 03051000
ffff8800b0bfc840 3539255952 S Co:1:001:0 s 23 01 0014 0005 0000 0
ffff8800b0bfc840 3539255974 C Co:1:001:0 0 0
ffff8800b0bfc840 3539255986 S Ci:1:000:0 s 80 06 0100 0000 0040 64 <
ffff8800b0bfc840 3539256275 C Ci:1:000:0 0 18 = 12010002 00000040 00b0a5a4 00000203 0001
ffff8800b0bfc840 3539256281 S Co:1:001:0 s 23 03 0004 0005 0000 0
ffff8800b0bfc840 3539256287 C Co:1:001:0 0 0
ffff880135b99f00 3539311951 S Ci:1:001:0 s a3 00 0000 0005 0004 4 <
ffff880135b99f00 3539312280 C Ci:1:001:0 0 4 = 03051000
ffff880135b99f00 3539367952 S Co:1:001:0 s 23 01 0014 0005 0000 0
ffff880135b99f00 3539367962 C Co:1:001:0 0 0
ffff880135b99f00 3539367966 S Co:1:000:0 s 00 05 0004 0000 0000 0
ffff880135b99f00 3539368147 C Co:1:000:0 0 0
ffff8800b0bfc900 3539387953 S Ci:1:004:0 s 80 06 0100 0000 0012 18 <
ffff8800b0bfc900 3539388149 C Ci:1:004:0 0 18 = 12010002 00000040 00b0a5a4 00000203 0001
ffff8800b0bfc900 3539388168 S Ci:1:004:0 s 80 06 0200 0000 0009 9 <
ffff8800b0bfc900 3539388272 C Ci:1:004:0 0 9 = 09022300 010100e0 fa
ffff880135b99900 3539388280 S Ci:1:004:0 s 80 06 0200 0000 0023 35 <
ffff880135b99900 3539388397 C Ci:1:004:0 0 35 = 09022300 010100e0 fa030903 09040000 02080650 01070581 02000200 07050102
ffff8800b0bfc540 3539388413 S Ci:1:004:0 s 80 06 0300 0000 00ff 255 <
ffff8800b0bfc540 3539388521 C Ci:1:004:0 0 4 = 04030904
ffff880135b99240 3539388533 S Ci:1:004:0 s 80 06 0303 0409 00ff 255 <
ffff880135b99240 3539388647 C Ci:1:004:0 0 56 = 38035400 72007500 73007400 65006400 20004d00 61007300 73002000 53007400
ffff8800b0bfc6c0 3539388654 S Ci:1:004:0 s 80 06 0302 0409 00ff 255 <
ffff8800b0bfc6c0 3539388772 C Ci:1:004:0 0 84 = 54034c00 69006e00 75007800 20003300 2e003500 2e003700 2d007900 6f006300
daveti - adsc input with len 20
ffff880135b99c00 3539388785 S Ci:1:004:0 s a1 00 0000 0000 0014 20 <
ffff880135b99c00 3539388898 C Ci:1:004:0 -32 0
daveti
ffff8800b0bfc6c0 3539389038 S Co:1:004:0 s 00 09 0001 0000 0000 0
ffff8800b0bfc6c0 3539397023 C Co:1:004:0 0 0
ffff88008f5b1a80 3539397057 S Ci:1:004:0 s 80 06 0301 0409 00ff 255 <
ffff88008f5b1a80 3539397397 C Ci:1:004:0 0 26 = 1a034d00 61007300 73002000 53007400 6f007200 61006700 6500
daveti - getMaxLun
ffff8801373326c0 3540443969 S Ci:1:004:0 s a1 fe 0000 0000 0001 1 <
ffff8801373326c0 3540444277 C Ci:1:004:0 0 1 = 00
daveti - adsc input with len 1
ffff8801373326c0 3540444302 S Ci:1:004:0 s a1 00 0000 0000 0001 1 <
ffff8801373326c0 3540444399 C Ci:1:004:0 -32 0
daveti
ffff8801373326c0 3540444448 S Bo:1:004:1 -115 31 = 55534243 01000000 24000000 80000612 00000024 00000000 00000000 000000
ffff8801373326c0 3540444523 C Bo:1:004:1 0 31 >
ffff88009da989c0 3540444541 S Bi:1:004:1 -115 36 <
ffff88009da989c0 3540444647 C Bi:1:004:1 0 36 = 00800202 1f000000 4c696e75 78202020 46696c65 2d434420 47616467 65742020
ffff8801373326c0 3540444666 S Bi:1:004:1 -115 13 <
ffff8801373326c0 3540444771 C Bi:1:004:1 0 13 = 55534253 01000000 00000000 00
ffff8801373326c0 3540445252 S Bo:1:004:1 -115 31 = 55534243 02000000 00000000 00000600 00000000 00000000 00000000 000000
ffff8801373326c0 3540445397 C Bo:1:004:1 0 31 >
ffff8801373326c0 3540445426 S Bi:1:004:1 -115 13 <
ffff8801373326c0 3540445648 C Bi:1:004:1 0 13 = 55534253 02000000 00000000 01
ffff8801373326c0 3540445678 S Bo:1:004:1 -115 31 = 55534243 03000000 12000000 80000603 00000012 00000000 00000000 000000
ffff8801373326c0 3540445772 C Bo:1:004:1 0 31 >
ffff880135c49780 3540445789 S Bi:1:004:1 -115 18 <
ffff880135c49780 3540446022 C Bi:1:004:1 0 18 = 70000600 0000000a 00000000 29000000 0000
ffff8801373326c0 3540446124 S Bi:1:004:1 -115 13 <
ffff8801373326c0 3540446273 C Bi:1:004:1 0 13 = 55534253 03000000 00000000 00
ffff8801373326c0 3540446601 S Bo:1:004:1 -115 31 = 55534243 04000000 00000000 00000600 00000000 00000000 00000000 000000
ffff8801373326c0 3540446648 C Bo:1:004:1 0 31 >
ffff8801373326c0 3540446666 S Bi:1:004:1 -115 13 <
ffff8801373326c0 3540446897 C Bi:1:004:1 0 13 = 55534253 04000000 00000000 00
ffff8801373326c0 3540446958 S Bo:1:004:1 -115 31 = 55534243 05000000 08000000 80000a25 00000000 00000000 00000000 000000
ffff8801373326c0 3540447023 C Bo:1:004:1 0 31 >
ffff880135c49780 3540447040 S Bi:1:004:1 -115 8 <
ffff880135c49780 3540447272 C Bi:1:004:1 0 8 = 0001ffff 00000200
ffff8801373326c0 3540447291 S Bi:1:004:1 -115 13 <
ffff8801373326c0 3540447397 C Bi:1:004:1 0 13 = 55534253 05000000 00000000 00
ffff8801373326c0 3540447464 S Bo:1:004:1 -115 31 = 55534243 06000000 c0000000 8000061a 003f00c0 00000000 00000000 000000
ffff8801373326c0 3540447523 C Bo:1:004:1 0 31 >
ffff88009da12c00 3540447864 S Bi:1:004:1 -115 192 <
ffff88009da12c00 3540448024 C Bi:1:004:1 -121 16 = 0f000000 080a0400 ffff0000 ffffffff
ffff8801373326c0 3540448057 S Bi:1:004:1 -115 13 <
ffff8801373326c0 3540552025 C Bi:1:004:1 -32 0
ffff8801373326c0 3540552046 S Co:1:004:0 s 02 01 0000 0081 0000 0
ffff8801373326c0 3540552150 C Co:1:004:0 0 0
ffff8801373326c0 3540552167 S Bi:1:004:1 -115 13 <
ffff8801373326c0 3540552397 C Bi:1:004:1 0 13 = 55534253 06000000 b0000000 00
ffff8801373326c0 3540552474 S Bo:1:004:1 -115 31 = 55534243 07000000 c0000000 8000061a 003f00c0 00000000 00000000 000000
ffff8801373326c0 3540552522 C Bo:1:004:1 0 31 >
ffff88009da98300 3540552538 S Bi:1:004:1 -115 192 <
ffff88009da98300 3540552773 C Bi:1:004:1 -121 16 = 0f000000 080a0400 ffff0000 ffffffff
ffff8801373326c0 3540552792 S Bi:1:004:1 -115 13 <
ffff8801373326c0 3540553147 C Bi:1:004:1 -32 0
ffff8801373326c0 3540553161 S Co:1:004:0 s 02 01 0000 0081 0000 0
ffff8801373326c0 3540553273 C Co:1:004:0 0 0
ffff8801373326c0 3540553286 S Bi:1:004:1 -115 13 <
ffff8801373326c0 3540553522 C Bi:1:004:1 0 13 = 55534253 07000000 b0000000 00
ffff8801373326c0 3540553681 S Bo:1:004:1 -115 31 = 55534243 08000000 00000000 00000600 00000000 00000000 00000000 000000
ffff8801373326c0 3540553772 C Bo:1:004:1 0 31 >
ffff8801373326c0 3540553848 S Bi:1:004:1 -115 13 <
ffff8801373326c0 3540553897 C Bi:1:004:1 0 13 = 55534253 08000000 00000000 00
ffff8801373326c0 3540553966 S Bo:1:004:1 -115 31 = 55534243 09000000 00000000 0000061e 00000001 00000000 00000000 000000
ffff8801373326c0 3540554022 C Bo:1:004:1 0 31 >
ffff8801373326c0 3540554051 S Bi:1:004:1 -115 13 <
ffff8801373326c0 3540554272 C Bi:1:004:1 0 13 = 55534253 09000000 00000000 00
ffff8801373326c0 3540554333 S Bo:1:004:1 -115 31 = 55534243 0a000000 00000000 00000600 00000000 00000000 00000000 000000
ffff8801373326c0 3540554397 C Bo:1:004:1 0 31 >
ffff8801373326c0 3540554436 S Bi:1:004:1 -115 13 <
ffff8801373326c0 3540554648 C Bi:1:004:1 0 13 = 55534253 0a000000 00000000 00
ffff8801373326c0 3540554720 S Bo:1:004:1 -115 31 = 55534243 0b000000 08000000 80000a25 00000000 00000000 00000000 000000
ffff8801373326c0 3540554772 C Bo:1:004:1 0 31 >
ffff88008f6e2b40 3540554872 S Bi:1:004:1 -115 8 <
ffff88008f6e2b40 3540555023 C Bi:1:004:1 0 8 = 0001ffff 00000200
ffff8801373326c0 3540555244 S Bi:1:004:1 -115 13 <
ffff8801373326c0 3540555273 C Bi:1:004:1 0 13 = 55534253 0b000000 00000000 00
ffff8801373326c0 3540555350 S Bo:1:004:1 -115 31 = 55534243 0c000000 c0000000 8000061a 003f00c0 00000000 00000000 000000
ffff8801373326c0 3540555398 C Bo:1:004:1 0 31 >
ffff88008f6e2540 3540555413 S Bi:1:004:1 -115 192 <
ffff88008f6e2540 3540555523 C Bi:1:004:1 -121 16 = 0f000000 080a0400 ffff0000 ffffffff
ffff8801373326c0 3540555543 S Bi:1:004:1 -115 13 <
ffff8801373326c0 3540555897 C Bi:1:004:1 -32 0
ffff8801373326c0 3540555912 S Co:1:004:0 s 02 01 0000 0081 0000 0
ffff8801373326c0 3540556023 C Co:1:004:0 0 0
ffff8801373326c0 3540556048 S Bi:1:004:1 -115 13 <
ffff8801373326c0 3540556271 C Bi:1:004:1 0 13 = 55534253 0c000000 b0000000 00
ffff8801373326c0 3540556333 S Bo:1:004:1 -115 31 = 55534243 0d000000 c0000000 8000061a 003f00c0 00000000 00000000 000000
ffff8801373326c0 3540556397 C Bo:1:004:1 0 31 >
ffff88008f6e2b40 3540556412 S Bi:1:004:1 -115 192 <
ffff88008f6e2b40 3540556647 C Bi:1:004:1 -121 16 = 0f000000 080a0400 ffff0000 ffffffff
ffff8801373326c0 3540556666 S Bi:1:004:1 -115 13 <
ffff8801373326c0 3540557022 C Bi:1:004:1 -32 0
ffff8801373326c0 3540557037 S Co:1:004:0 s 02 01 0000 0081 0000 0
ffff8801373326c0 3540557148 C Co:1:004:0 0 0
ffff8801373326c0 3540557161 S Bi:1:004:1 -115 13 <
ffff8801373326c0 3540557396 C Bi:1:004:1 0 13 = 55534253 0d000000 b0000000 00
ffff8801373326c0 3540557479 S Bo:1:004:1 -115 31 = 55534243 0e000000 00100000 80000a28 00000000 00000008 00000000 000000
ffff8801373326c0 3540557522 C Bo:1:004:1 0 31 >
ffff88008f6e2f00 3540557538 S Bi:1:004:1 -115 4096 <
ffff88008f6e2f00 3540579773 C Bi:1:004:1 0 4096 = eb3c906d 6b646f73 66730000 02040100 02000200 00f88000 20004000 00000000
ffff8801373326c0 3540579794 S Bi:1:004:1 -115 13 <
ffff8801373326c0 3540580022 C Bi:1:004:1 0 13 = 55534253 0e000000 00000000 00
ffff8801373326c0 3540580115 S Bo:1:004:1 -115 31 = 55534243 0f000000 00000000 0000061e 00000000 00000000 00000000 000000
ffff8801373326c0 3540580151 C Bo:1:004:1 0 31 >
ffff8801373326c0 3540580163 S Bi:1:004:1 -115 13 <
ffff8801373326c0 3540590523 C Bi:1:004:1 0 13 = 55534253 0f000000 00000000 00
ffff8801373326c0 3540590684 S Bo:1:004:1 -115 31 = 55534243 10000000 00000000 00000600 00000000 00000000 00000000 000000
ffff8801373326c0 3540590772 C Bo:1:004:1 0 31 >
ffff8801373326c0 3540590784 S Bi:1:004:1 -115 13 <
ffff8801373326c0 3540591021 C Bi:1:004:1 0 13 = 55534253 10000000 00000000 00
ffff8801373326c0 3540591060 S Bo:1:004:1 -115 31 = 55534243 11000000 00000000 00000600 00000000 00000000 00000000 000000
ffff8801373326c0 3540591147 C Bo:1:004:1 0 31 >
ffff8801373326c0 3540591168 S Bi:1:004:1 -115 13 <
ffff8801373326c0 3540591272 C Bi:1:004:1 0 13 = 55534253 11000000 00000000 00
ffff8801373326c0 3540591321 S Bo:1:004:1 -115 31 = 55534243 12000000 08000000 80000a25 00000000 00000000 00000000 000000
ffff8801373326c0 3540591396 C Bo:1:004:1 0 31 >
ffff88009da980c0 3540591411 S Bi:1:004:1 -115 8 <
ffff88009da980c0 3540591523 C Bi:1:004:1 0 8 = 0001ffff 00000200
ffff8801373326c0 3540591550 S Bi:1:004:1 -115 13 <
ffff8801373326c0 3540591646 C Bi:1:004:1 0 13 = 55534253 12000000 00000000 00
ffff8801373326c0 3540591683 S Bo:1:004:1 -115 31 = 55534243 13000000 00000000 00000600 00000000 00000000 00000000 000000
ffff8801373326c0 3540591771 C Bo:1:004:1 0 31 >
ffff8801373326c0 3540591783 S Bi:1:004:1 -115 13 <
ffff8801373326c0 3540591896 C Bi:1:004:1 0 13 = 55534253 13000000 00000000 00
ffff8801373326c0 3540591960 S Bo:1:004:1 -115 31 = 55534243 14000000 c0000000 8000061a 003f00c0 00000000 00000000 000000
ffff8801373326c0 3540592022 C Bo:1:004:1 0 31 >
ffff88008f6e23c0 3540592037 S Bi:1:004:1 -115 192 <
ffff88008f6e23c0 3540592272 C Bi:1:004:1 -121 16 = 0f000000 080a0400 ffff0000 ffffffff
ffff8801373326c0 3540592284 S Bi:1:004:1 -115 13 <
ffff8801373326c0 3540592647 C Bi:1:004:1 -32 0
ffff8801373326c0 3540592663 S Co:1:004:0 s 02 01 0000 0081 0000 0
ffff8801373326c0 3540592773 C Co:1:004:0 0 0
ffff8801373326c0 3540592787 S Bi:1:004:1 -115 13 <
ffff8801373326c0 3540593022 C Bi:1:004:1 0 13 = 55534253 14000000 b0000000 00
ffff8801373326c0 3540593071 S Bo:1:004:1 -115 31 = 55534243 15000000 00000000 00000600 00000000 00000000 00000000 000000
ffff8801373326c0 3540593147 C Bo:1:004:1 0 31 >
ffff8801373326c0 3540593164 S Bi:1:004:1 -115 13 <
ffff8801373326c0 3540593396 C Bi:1:004:1 0 13 = 55534253 15000000 00000000 00
ffff8801373326c0 3540593443 S Bo:1:004:1 -115 31 = 55534243 16000000 c0000000 8000061a 003f00c0 00000000 00000000 000000
ffff8801373326c0 3540593521 C Bo:1:004:1 0 31 >
ffff88009da98cc0 3540593537 S Bi:1:004:1 -115 192 <
ffff88009da98cc0 3540593773 C Bi:1:004:1 -121 16 = 0f000000 080a0400 ffff0000 ffffffff
ffff8801373326c0 3540593791 S Bi:1:004:1 -115 13 <
ffff8801373326c0 3540594147 C Bi:1:004:1 -32 0
ffff8801373326c0 3540594161 S Co:1:004:0 s 02 01 0000 0081 0000 0
ffff8801373326c0 3540594273 C Co:1:004:0 0 0
ffff8801373326c0 3540594286 S Bi:1:004:1 -115 13 <
ffff8801373326c0 3540594522 C Bi:1:004:1 0 13 = 55534253 16000000 b0000000 00
ffff8801373326c0 3540594570 S Bo:1:004:1 -115 31 = 55534243 17000000 00000000 0000061e 00000001 00000000 00000000 000000
ffff8801373326c0 3540594647 C Bo:1:004:1 0 31 >
ffff8801373326c0 3540594664 S Bi:1:004:1 -115 13 <
ffff8801373326c0 3540594896 C Bi:1:004:1 0 13 = 55534253 17000000 00000000 00
ffff8801373326c0 3540595012 S Bo:1:004:1 -115 31 = 55534243 18000000 00100000 80000a28 000001ff 80000008 00000000 000000
ffff8801373326c0 3540595146 C Bo:1:004:1 0 31 >
ffff88009da98cc0 3540595156 S Bi:1:004:1 -115 4096 <
ffff88009da98cc0 3540614022 C Bi:1:004:1 0 4096 = 00000000 00000000 00000000 00000000 00000000 00000000 00000000 00000000
ffff8801373326c0 3540614044 S Bi:1:004:1 -115 13 <
ffff8801373326c0 3540614147 C Bi:1:004:1 0 13 = 55534253 18000000 00000000 00
ffff8801373326c0 3540614224 S Bo:1:004:1 -115 31 = 55534243 19000000 00100000 80000a28 000001ff f0000008 00000000 000000
ffff8801373326c0 3540614272 C Bo:1:004:1 0 31 >
ffff88008f6e2f00 3540614288 S Bi:1:004:1 -115 4096 <
ffff88008f6e2f00 3540627649 C Bi:1:004:1 0 4096 = 00000000 00000000 00000000 00000000 00000000 00000000 00000000 00000000
ffff8801373326c0 3540627670 S Bi:1:004:1 -115 13 <
ffff8801373326c0 3540627772 C Bi:1:004:1 0 13 = 55534253 19000000 00000000 00
ffff8801373326c0 3540627851 S Bo:1:004:1 -115 31 = 55534243 1a000000 00100000 80000a28 00000000 00000008 00000000 000000
ffff8801373326c0 3540627897 C Bo:1:004:1 0 31 >
ffff88009da98000 3540627913 S Bi:1:004:1 -115 4096 <
ffff88009da98000 3540639273 C Bi:1:004:1 0 4096 = eb3c906d 6b646f73 66730000 02040100 02000200 00f88000 20004000 00000000
ffff8801373326c0 3540639294 S Bi:1:004:1 -115 13 <
ffff8801373326c0 3540639522 C Bi:1:004:1 0 13 = 55534253 1a000000 00000000 00
ffff8801373326c0 3540639591 S Bo:1:004:1 -115 31 = 55534243 1b000000 00100000 80000a28 00000000 08000008 00000000 000000
ffff8801373326c0 3540639647 C Bo:1:004:1 0 31 >
ffff88008f6e2780 3540639664 S Bi:1:004:1 -115 4096 <
ffff88008f6e2780 3540651272 C Bi:1:004:1 0 4096 = 00000000 00000000 00000000 00000000 00000000 00000000 00000000 00000000
ffff8801373326c0 3540651294 S Bi:1:004:1 -115 13 <
ffff8801373326c0 3540651521 C Bi:1:004:1 0 13 = 55534253 1b000000 00000000 00
ffff8801373326c0 3540651593 S Bo:1:004:1 -115 31 = 55534243 1c000000 00020000 80000a28 000001ff f8000001 00000000 000000
ffff8801373326c0 3540651646 C Bo:1:004:1 0 31 >
ffff88009da98180 3540651663 S Bi:1:004:1 -115 512 <
ffff88009da98180 3540665399 C Bi:1:004:1 0 512 = 00000000 00000000 00000000 00000000 00000000 00000000 00000000 00000000
ffff8801373326c0 3540665420 S Bi:1:004:1 -115 13 <
ffff8801373326c0 3540665522 C Bi:1:004:1 0 13 = 55534253 1c000000 00000000 00
ffff8801373326c0 3540665578 S Bo:1:004:1 -115 31 = 55534243 1d000000 00020000 80000a28 000001ff f9000001 00000000 000000
ffff8801373326c0 3540665647 C Bo:1:004:1 0 31 >
ffff88009da98180 3540665662 S Bi:1:004:1 -115 512 <
ffff88009da98180 3540677523 C Bi:1:004:1 0 512 = 00000000 00000000 00000000 00000000 00000000 00000000 00000000 00000000
ffff8801373326c0 3540677544 S Bi:1:004:1 -115 13 <
ffff8801373326c0 3540677647 C Bi:1:004:1 0 13 = 55534253 1d000000 00000000 00
ffff8801373326c0 3540677703 S Bo:1:004:1 -115 31 = 55534243 1e000000 00020000 80000a28 000001ff fa000001 00000000 000000
ffff8801373326c0 3540677772 C Bo:1:004:1 0 31 >
ffff88008f6e23c0 3540677787 S Bi:1:004:1 -115 512 <
ffff88008f6e23c0 3540689898 C Bi:1:004:1 0 512 = 00000000 00000000 00000000 00000000 00000000 00000000 00000000 00000000
ffff8801373326c0 3540689918 S Bi:1:004:1 -115 13 <
ffff8801373326c0 3540690022 C Bi:1:004:1 0 13 = 55534253 1e000000 00000000 00
ffff8801373326c0 3540690076 S Bo:1:004:1 -115 31 = 55534243 1f000000 00020000 80000a28 000001ff fb000001 00000000 000000
ffff8801373326c0 3540690147 C Bo:1:004:1 0 31 >
ffff88008f6e23c0 3540690162 S Bi:1:004:1 -115 512 <
ffff88008f6e23c0 3540702273 C Bi:1:004:1 0 512 = 00000000 00000000 00000000 00000000 00000000 00000000 00000000 00000000
ffff8801373326c0 3540702293 S Bi:1:004:1 -115 13 <
ffff8801373326c0 3540702397 C Bi:1:004:1 0 13 = 55534253 1f000000 00000000 00
ffff8801373326c0 3540702452 S Bo:1:004:1 -115 31 = 55534243 20000000 00020000 80000a28 000001ff fc000001 00000000 000000
ffff8801373326c0 3540702522 C Bo:1:004:1 0 31 >
ffff88009da98e40 3540702537 S Bi:1:004:1 -115 512 <
ffff88009da98e40 3540714273 C Bi:1:004:1 0 512 = 00000000 00000000 00000000 00000000 00000000 00000000 00000000 00000000
ffff8801373326c0 3540714294 S Bi:1:004:1 -115 13 <
ffff8801373326c0 3540714397 C Bi:1:004:1 0 13 = 55534253 20000000 00000000 00
ffff8801373326c0 3540714452 S Bo:1:004:1 -115 31 = 55534243 21000000 00020000 80000a28 000001ff fd000001 00000000 000000
ffff8801373326c0 3540714522 C Bo:1:004:1 0 31 >
ffff88008f6e2c00 3540714537 S Bi:1:004:1 -115 512 <
ffff88008f6e2c00 3540726273 C Bi:1:004:1 0 512 = 00000000 00000000 00000000 00000000 00000000 00000000 00000000 00000000
ffff8801373326c0 3540726295 S Bi:1:004:1 -115 13 <
ffff8801373326c0 3540726397 C Bi:1:004:1 0 13 = 55534253 21000000 00000000 00
ffff8801373326c0 3540726451 S Bo:1:004:1 -115 31 = 55534243 22000000 00020000 80000a28 000001ff fe000001 00000000 000000
ffff8801373326c0 3540726522 C Bo:1:004:1 0 31 >
ffff88009da98300 3540726537 S Bi:1:004:1 -115 512 <
ffff88009da98300 3540738522 C Bi:1:004:1 0 512 = 00000000 00000000 00000000 00000000 00000000 00000000 00000000 00000000
ffff8801373326c0 3540738541 S Bi:1:004:1 -115 13 <
ffff8801373326c0 3540738646 C Bi:1:004:1 0 13 = 55534253 22000000 00000000 00
ffff8801373326c0 3540738700 S Bo:1:004:1 -115 31 = 55534243 23000000 00020000 80000a28 000001ff ff000001 00000000 000000
ffff8801373326c0 3540738773 C Bo:1:004:1 0 31 >
ffff88009da98300 3540738788 S Bi:1:004:1 -115 512 <
ffff88009da98300 3540750647 C Bi:1:004:1 0 512 = 00000000 00000000 00000000 00000000 00000000 00000000 00000000 00000000
ffff8801373326c0 3540750668 S Bi:1:004:1 -115 13 <
ffff8801373326c0 3540750772 C Bi:1:004:1 0 13 = 55534253 23000000 00000000 00
ffff8801373326c0 3540750847 S Bo:1:004:1 -115 31 = 55534243 24000000 00100000 80000a28 000001fe f8000008 00000000 000000
ffff8801373326c0 3540750897 C Bo:1:004:1 0 31 >
ffff88008f6e2300 3540750913 S Bi:1:004:1 -115 4096 <
ffff88008f6e2300 3540765148 C Bi:1:004:1 0 4096 = 00000000 00000000 00000000 00000000 00000000 00000000 00000000 00000000
ffff8801373326c0 3540765169 S Bi:1:004:1 -115 13 <
ffff8801373326c0 3540765397 C Bi:1:004:1 0 13 = 55534253 24000000 00000000 00
ffff8801373326c0 3540765615 S Bo:1:004:1 -115 31 = 55534243 25000000 00100000 80000a28 000001ff c0000008 00000000 000000
ffff8801373326c0 3540765647 C Bo:1:004:1 0 31 >
ffff88008f6e2600 3540765663 S Bi:1:004:1 -115 4096 <
ffff88008f6e2600 3540778772 C Bi:1:004:1 0 4096 = 00000000 00000000 00000000 00000000 00000000 00000000 00000000 00000000
ffff8801373326c0 3540778792 S Bi:1:004:1 -115 13 <
ffff8801373326c0 3540779024 C Bi:1:004:1 0 13 = 55534253 25000000 00000000 00
ffff8801373326c0 3540779093 S Bo:1:004:1 -115 31 = 55534243 26000000 00100000 80000a28 000001ff 00000008 00000000 000000
ffff8801373326c0 3540779272 C Bo:1:004:1 0 31 >
ffff88009da980c0 3540779287 S Bi:1:004:1 -115 4096 <
ffff88009da980c0 3540792024 C Bi:1:004:1 0 4096 = 00000000 00000000 00000000 00000000 00000000 00000000 00000000 00000000
ffff8801373326c0 3540792044 S Bi:1:004:1 -115 13 <
ffff8801373326c0 3540792272 C Bi:1:004:1 0 13 = 55534253 26000000 00000000 00
ffff8801373326c0 3540792344 S Bo:1:004:1 -115 31 = 55534243 27000000 00100000 80000a28 000001fe 70000008 00000000 000000
ffff8801373326c0 3540792397 C Bo:1:004:1 0 31 >
ffff88009da98d80 3540792413 S Bi:1:004:1 -115 4096 <
ffff88009da98d80 3540806774 C Bi:1:004:1 0 4096 = 00000000 00000000 00000000 00000000 00000000 00000000 00000000 00000000
ffff8801373326c0 3540806794 S Bi:1:004:1 -115 13 <
ffff8801373326c0 3540806897 C Bi:1:004:1 0 13 = 55534253 27000000 00000000 00
ffff8801373326c0 3540806966 S Bo:1:004:1 -115 31 = 55534243 28000000 00100000 80000a28 000001fd b0000008 00000000 000000
ffff8801373326c0 3540807022 C Bo:1:004:1 0 31 >
ffff88009da98b40 3540807038 S Bi:1:004:1 -115 4096 <
ffff88009da98b40 3540820773 C Bi:1:004:1 0 4096 = 00000000 00000000 00000000 00000000 00000000 00000000 00000000 00000000
ffff8801373326c0 3540820795 S Bi:1:004:1 -115 13 <
ffff8801373326c0 3540821022 C Bi:1:004:1 0 13 = 55534253 28000000 00000000 00
ffff8801373326c0 3540821094 S Bo:1:004:1 -115 31 = 55534243 29000000 00100000 80000a28 000001fd 58000008 00000000 000000
ffff8801373326c0 3540821147 C Bo:1:004:1 0 31 >
ffff88009da98d80 3540821165 S Bi:1:004:1 -115 4096 <
ffff88009da98d80 3540834522 C Bi:1:004:1 0 4096 = 00000000 00000000 00000000 00000000 00000000 00000000 00000000 00000000
ffff8801373326c0 3540834544 S Bi:1:004:1 -115 13 <
ffff8801373326c0 3540834772 C Bi:1:004:1 0 13 = 55534253 29000000 00000000 00
ffff8801373326c0 3540834840 S Bo:1:004:1 -115 31 = 55534243 2a000000 00100000 80000a28 000001fd 20000008 00000000 000000
ffff8801373326c0 3540834897 C Bo:1:004:1 0 31 >
ffff88008f6e2300 3540834913 S Bi:1:004:1 -115 4096 <
ffff88008f6e2300 3540849022 C Bi:1:004:1 0 4096 = 00000000 00000000 00000000 00000000 00000000 00000000 00000000 00000000
ffff8801373326c0 3540849043 S Bi:1:004:1 -115 13 <
ffff8801373326c0 3540849397 C Bi:1:004:1 0 13 = 55534253 2a000000 00000000 00
ffff8801373326c0 3540849466 S Bo:1:004:1 -115 31 = 55534243 2b000000 00100000 80000a28 000001fc 70000008 00000000 000000
ffff8801373326c0 3540849522 C Bo:1:004:1 0 31 >
ffff88008f6e2480 3540849539 S Bi:1:004:1 -115 4096 <
ffff88008f6e2480 3540863397 C Bi:1:004:1 0 4096 = 00000000 00000000 00000000 00000000 00000000 00000000 00000000 00000000
ffff8801373326c0 3540863418 S Bi:1:004:1 -115 13 <
ffff8801373326c0 3540863522 C Bi:1:004:1 0 13 = 55534253 2b000000 00000000 00
ffff8801373326c0 3540863596 S Bo:1:004:1 -115 31 = 55534243 2c000000 00100000 80000a28 000001fc 30000008 00000000 000000
ffff8801373326c0 3540863647 C Bo:1:004:1 0 31 >
ffff88009da98b40 3540863669 S Bi:1:004:1 -115 4096 <
ffff88009da98b40 3540877401 C Bi:1:004:1 0 4096 = 00000000 00000000 00000000 00000000 00000000 00000000 00000000 00000000
ffff8801373326c0 3540877421 S Bi:1:004:1 -115 13 <
ffff8801373326c0 3540877523 C Bi:1:004:1 0 13 = 55534253 2c000000 00000000 00
ffff8801373326c0 3540877591 S Bo:1:004:1 -115 31 = 55534243 2d000000 00100000 80000a28 000001fc 20000008 00000000 000000
ffff8801373326c0 3540877772 C Bo:1:004:1 0 31 >
ffff88008f6e2300 3540877788 S Bi:1:004:1 -115 4096 <
ffff88008f6e2300 3540891022 C Bi:1:004:1 0 4096 = 00000000 00000000 00000000 00000000 00000000 00000000 00000000 00000000
ffff8801373326c0 3540891043 S Bi:1:004:1 -115 13 <
ffff8801373326c0 3540891272 C Bi:1:004:1 0 13 = 55534253 2d000000 00000000 00
ffff8801373326c0 3540891340 S Bo:1:004:1 -115 31 = 55534243 2e000000 00100000 80000a28 000001fc 48000008 00000000 000000
ffff8801373326c0 3540891397 C Bo:1:004:1 0 31 >
ffff88009da98300 3540891413 S Bi:1:004:1 -115 4096 <
ffff88009da98300 3540903898 C Bi:1:004:1 0 4096 = 00000000 00000000 00000000 00000000 00000000 00000000 00000000 00000000
ffff8801373326c0 3540903919 S Bi:1:004:1 -115 13 <
ffff8801373326c0 3540904147 C Bi:1:004:1 0 13 = 55534253 2e000000 00000000 00
ffff8801373326c0 3540904216 S Bo:1:004:1 -115 31 = 55534243 2f000000 00100000 80000a28 000001f3 f0000008 00000000 000000
ffff8801373326c0 3540904272 C Bo:1:004:1 0 31 >
ffff88008f6e23c0 3540904289 S Bi:1:004:1 -115 4096 <
ffff88008f6e23c0 3540917899 C Bi:1:004:1 0 4096 = 00000000 00000000 00000000 00000000 00000000 00000000 00000000 00000000
ffff8801373326c0 3540917918 S Bi:1:004:1 -115 13 <
ffff8801373326c0 3540918022 C Bi:1:004:1 0 13 = 55534253 2f000000 00000000 00
ffff8801373326c0 3540918116 S Bo:1:004:1 -115 31 = 55534243 30000000 00100000 80000a28 00000008 00000008 00000000 000000
ffff8801373326c0 3540918147 C Bo:1:004:1 0 31 >
ffff88008f6e2780 3540918164 S Bi:1:004:1 -115 4096 <
ffff88008f6e2780 3540932398 C Bi:1:004:1 0 4096 = 00000000 00000000 00000000 00000000 00000000 00000000 00000000 00000000
ffff8801373326c0 3540932418 S Bi:1:004:1 -115 13 <
ffff8801373326c0 3540932646 C Bi:1:004:1 0 13 = 55534253 30000000 00000000 00
ffff8801373326c0 3540932742 S Bo:1:004:1 -115 31 = 55534243 31000000 00500000 80000a28 00000001 00000028 00000000 000000
ffff8801373326c0 3540932771 C Bo:1:004:1 0 31 >
ffff88008f6e23c0 3540932788 S Bi:1:004:1 -115 20480 <
ffff88008f6e23c0 3540947773 C Bi:1:004:1 0 20480 = 00000000 00000000 00000000 00000000 00000000 00000000 00000000 00000000
ffff8801373326c0 3540947792 S Bi:1:004:1 -115 13 <
ffff8801373326c0 3540948022 C Bi:1:004:1 0 13 = 55534253 31000000 00000000 00
ffff8801373326c0 3540948118 S Bo:1:004:1 -115 31 = 55534243 32000000 00100000 80000a28 00000000 18000008 00000000 000000
ffff8801373326c0 3540948272 C Bo:1:004:1 0 31 >
ffff88008f6e2c00 3540948289 S Bi:1:004:1 -115 4096 <
ffff88008f6e2c00 3540960397 C Bi:1:004:1 0 4096 = 00000000 00000000 00000000 00000000 00000000 00000000 00000000 00000000
ffff8801373326c0 3540960418 S Bi:1:004:1 -115 13 <
ffff8801373326c0 3540960772 C Bi:1:004:1 0 13 = 55534253 32000000 00000000 00
ffff8801373326c0 3540960842 S Bo:1:004:1 -115 31 = 55534243 33000000 00100000 80000a28 00000000 38000008 00000000 000000
ffff8801373326c0 3540960897 C Bo:1:004:1 0 31 >
ffff88009da98e40 3540960914 S Bi:1:004:1 -115 4096 <
ffff88009da98e40 3540972272 C Bi:1:004:1 0 4096 = 00000000 00000000 00000000 00000000 00000000 00000000 00000000 00000000
ffff8801373326c0 3540972293 S Bi:1:004:1 -115 13 <
ffff8801373326c0 3540972522 C Bi:1:004:1 0 13 = 55534253 33000000 00000000 00
ffff8801373326c0 3540972590 S Bo:1:004:1 -115 31 = 55534243 34000000 00100000 80000a28 00000000 78000008 00000000 000000
ffff8801373326c0 3540972647 C Bo:1:004:1 0 31 >
ffff88009da98180 3540972664 S Bi:1:004:1 -115 4096 <
ffff88009da98180 3540985022 C Bi:1:004:1 0 4096 = 00000000 00000000 00000000 00000000 00000000 00000000 00000000 00000000
ffff8801373326c0 3540985041 S Bi:1:004:1 -115 13 <
ffff8801373326c0 3540985147 C Bi:1:004:1 0 13 = 55534253 34000000 00000000 00
ffff8801373326c0 3540985225 S Bo:1:004:1 -115 31 = 55534243 35000000 00100000 80000a28 00000000 10000008 00000000 000000
ffff8801373326c0 3540985272 C Bo:1:004:1 0 31 >
ffff88009da98000 3540985288 S Bi:1:004:1 -115 4096 <
ffff88009da98000 3540996898 C Bi:1:004:1 0 4096 = 00000000 00000000 00000000 00000000 00000000 00000000 00000000 00000000
ffff8801373326c0 3540996918 S Bi:1:004:1 -115 13 <
ffff8801373326c0 3540997146 C Bi:1:004:1 0 13 = 55534253 35000000 00000000 00
ffff8801373326c0 3540997214 S Bo:1:004:1 -115 31 = 55534243 36000000 00100000 80000a28 00000000 80000008 00000000 000000
ffff8801373326c0 3540997272 C Bo:1:004:1 0 31 >
ffff88008f6e2300 3540997288 S Bi:1:004:1 -115 4096 <
ffff88008f6e2300 3541012898 C Bi:1:004:1 0 4096 = 00000000 00000000 00000000 00000000 00000000 00000000 00000000 00000000
ffff8801373326c0 3541012918 S Bi:1:004:1 -115 13 <
ffff8801373326c0 3541013147 C Bi:1:004:1 0 13 = 55534253 36000000 00000000 00
ffff8801373326c0 3541013214 S Bo:1:004:1 -115 31 = 55534243 37000000 00100000 80000a28 00000000 40000008 00000000 000000
ffff8801373326c0 3541013272 C Bo:1:004:1 0 31 >
ffff88008f6e2480 3541013288 S Bi:1:004:1 -115 4096 <
ffff88008f6e2480 3541024772 C Bi:1:004:1 0 4096 = 00000000 00000000 00000000 00000000 00000000 00000000 00000000 00000000
ffff8801373326c0 3541024791 S Bi:1:004:1 -115 13 <
ffff8801373326c0 3541025022 C Bi:1:004:1 0 13 = 55534253 37000000 00000000 00
ffff8801373326c0 3541025098 S Bo:1:004:1 -115 31 = 55534243 38000000 00100000 80000a28 00000001 28000008 00000000 000000
ffff8801373326c0 3541025147 C Bo:1:004:1 0 31 >
ffff88008f6e2600 3541025163 S Bi:1:004:1 -115 4096 <
ffff88008f6e2600 3541036772 C Bi:1:004:1 0 4096 = 00000000 00000000 00000000 00000000 00000000 00000000 00000000 00000000
ffff8801373326c0 3541036792 S Bi:1:004:1 -115 13 <
ffff8801373326c0 3541037022 C Bi:1:004:1 0 13 = 55534253 38000000 00000000 00
ffff8801373326c0 3541037090 S Bo:1:004:1 -115 31 = 55534243 39000000 00100000 80000a28 00000001 30000008 00000000 000000
ffff8801373326c0 3541037147 C Bo:1:004:1 0 31 >
ffff88008f6e2480 3541037164 S Bi:1:004:1 -115 4096 <
ffff88008f6e2480 3541048897 C Bi:1:004:1 0 4096 = 00000000 00000000 00000000 00000000 00000000 00000000 00000000 00000000
ffff8801373326c0 3541048917 S Bi:1:004:1 -115 13 <
ffff8801373326c0 3541049272 C Bi:1:004:1 0 13 = 55534253 39000000 00000000 00
ffff8801373326c0 3541049338 S Bo:1:004:1 -115 31 = 55534243 3a000000 00100000 80000a28 00000001 38000008 00000000 000000
ffff8801373326c0 3541049397 C Bo:1:004:1 0 31 >
ffff88008f6e2300 3541049413 S Bi:1:004:1 -115 4096 <
ffff88008f6e2300 3541061023 C Bi:1:004:1 0 4096 = 00000000 00000000 00000000 00000000 00000000 00000000 00000000 00000000
ffff8801373326c0 3541061043 S Bi:1:004:1 -115 13 <
ffff8801373326c0 3541061272 C Bi:1:004:1 0 13 = 55534253 3a000000 00000000 00
ffff8801373326c0 3541061340 S Bo:1:004:1 -115 31 = 55534243 3b000000 00100000 80000a28 00000001 40000008 00000000 000000
ffff8801373326c0 3541061397 C Bo:1:004:1 0 31 >
ffff880135c49e40 3541061413 S Bi:1:004:1 -115 4096 <
ffff880135c49e40 3541073772 C Bi:1:004:1 0 4096 = 00000000 00000000 00000000 00000000 00000000 00000000 00000000 00000000
ffff8801373326c0 3541073792 S Bi:1:004:1 -115 13 <
ffff8801373326c0 3541074022 C Bi:1:004:1 0 13 = 55534253 3b000000 00000000 00
ffff8801373326c0 3541074095 S Bo:1:004:1 -115 31 = 55534243 3c000000 00100000 80000a28 00000001 48000008 00000000 000000
ffff8801373326c0 3541074396 C Bo:1:004:1 0 31 >
ffff88009da980c0 3541074413 S Bi:1:004:1 -115 4096 <
ffff88009da980c0 3541086272 C Bi:1:004:1 0 4096 = 00000000 00000000 00000000 00000000 00000000 00000000 00000000 00000000
ffff8801373326c0 3541086291 S Bi:1:004:1 -115 13 <
ffff8801373326c0 3541086522 C Bi:1:004:1 0 13 = 55534253 3c000000 00000000 00
ffff8801373326c0 3541086588 S Bo:1:004:1 -115 31 = 55534243 3d000000 00100000 80000a28 00000001 50000008 00000000 000000
ffff8801373326c0 3541086647 C Bo:1:004:1 0 31 >
ffff88009da98e40 3541086664 S Bi:1:004:1 -115 4096 <
ffff88009da98e40 3541099273 C Bi:1:004:1 0 4096 = 00000000 00000000 00000000 00000000 00000000 00000000 00000000 00000000
ffff8801373326c0 3541099293 S Bi:1:004:1 -115 13 <
ffff8801373326c0 3541099522 C Bi:1:004:1 0 13 = 55534253 3d000000 00000000 00
ffff8801373326c0 3541099589 S Bo:1:004:1 -115 31 = 55534243 3e000000 00100000 80000a28 00000001 58000008 00000000 000000
ffff8801373326c0 3541099647 C Bo:1:004:1 0 31 >
ffff88008f6e23c0 3541099663 S Bi:1:004:1 -115 4096 <
ffff88008f6e23c0 3541111272 C Bi:1:004:1 0 4096 = 00000000 00000000 00000000 00000000 00000000 00000000 00000000 00000000
ffff8801373326c0 3541111292 S Bi:1:004:1 -115 13 <
ffff8801373326c0 3541111522 C Bi:1:004:1 0 13 = 55534253 3e000000 00000000 00
ffff8801373326c0 3541111589 S Bo:1:004:1 -115 31 = 55534243 3f000000 00100000 80000a28 00000001 60000008 00000000 000000
ffff8801373326c0 3541111647 C Bo:1:004:1 0 31 >
ffff88009da989c0 3541111663 S Bi:1:004:1 -115 4096 <
ffff88009da989c0 3541123272 C Bi:1:004:1 0 4096 = 00000000 00000000 00000000 00000000 00000000 00000000 00000000 00000000
ffff8801373326c0 3541123291 S Bi:1:004:1 -115 13 <
ffff8801373326c0 3541123522 C Bi:1:004:1 0 13 = 55534253 3f000000 00000000 00
ffff8801373326c0 3541123588 S Bo:1:004:1 -115 31 = 55534243 40000000 00100000 80000a28 00000001 68000008 00000000 000000
ffff8801373326c0 3541123647 C Bo:1:004:1 0 31 >
ffff88009da98d80 3541123663 S Bi:1:004:1 -115 4096 <
ffff88009da98d80 3541135147 C Bi:1:004:1 0 4096 = 00000000 00000000 00000000 00000000 00000000 00000000 00000000 00000000
ffff8801373326c0 3541135166 S Bi:1:004:1 -115 13 <
ffff8801373326c0 3541135397 C Bi:1:004:1 0 13 = 55534253 40000000 00000000 00
ffff8801373326c0 3541135464 S Bo:1:004:1 -115 31 = 55534243 41000000 00100000 80000a28 00000001 70000008 00000000 000000
ffff8801373326c0 3541135522 C Bo:1:004:1 0 31 >
ffff88009da98180 3541135538 S Bi:1:004:1 -115 4096 <
ffff88009da98180 3541147398 C Bi:1:004:1 0 4096 = 00000000 00000000 00000000 00000000 00000000 00000000 00000000 00000000
ffff8801373326c0 3541147418 S Bi:1:004:1 -115 13 <
ffff8801373326c0 3541147647 C Bi:1:004:1 0 13 = 55534253 41000000 00000000 00
ffff8801373326c0 3541147714 S Bo:1:004:1 -115 31 = 55534243 42000000 00100000 80000a28 00000001 78000008 00000000 000000
ffff8801373326c0 3541147772 C Bo:1:004:1 0 31 >
ffff88008f6e2c00 3541147793 S Bi:1:004:1 -115 4096 <
ffff88008f6e2c00 3541159523 C Bi:1:004:1 0 4096 = 00000000 00000000 00000000 00000000 00000000 00000000 00000000 00000000
ffff8801373326c0 3541159542 S Bi:1:004:1 -115 13 <
ffff8801373326c0 3541159772 C Bi:1:004:1 0 13 = 55534253 42000000 00000000 00
ffff8801373326c0 3541159839 S Bo:1:004:1 -115 31 = 55534243 43000000 00100000 80000a28 00000001 80000008 00000000 000000
ffff8801373326c0 3541159897 C Bo:1:004:1 0 31 >
ffff88008f6e2540 3541159914 S Bi:1:004:1 -115 4096 <
ffff88008f6e2540 3541171522 C Bi:1:004:1 0 4096 = 00000000 00000000 00000000 00000000 00000000 00000000 00000000 00000000
ffff8801373326c0 3541171542 S Bi:1:004:1 -115 13 <
ffff8801373326c0 3541171772 C Bi:1:004:1 0 13 = 55534253 43000000 00000000 00
ffff8801373326c0 3541171837 S Bo:1:004:1 -115 31 = 55534243 44000000 00100000 80000a28 00000001 88000008 00000000 000000
ffff8801373326c0 3541171897 C Bo:1:004:1 0 31 >
ffff88008f6e2b40 3541171913 S Bi:1:004:1 -115 4096 <
ffff88008f6e2b40 3541183272 C Bi:1:004:1 0 4096 = 00000000 00000000 00000000 00000000 00000000 00000000 00000000 00000000
ffff8801373326c0 3541183292 S Bi:1:004:1 -115 13 <
ffff8801373326c0 3541183522 C Bi:1:004:1 0 13 = 55534253 44000000 00000000 00
ffff8801373326c0 3541183587 S Bo:1:004:1 -115 31 = 55534243 45000000 00100000 80000a28 00000001 90000008 00000000 000000
ffff8801373326c0 3541183647 C Bo:1:004:1 0 31 >
ffff88008f6e26c0 3541183663 S Bi:1:004:1 -115 4096 <
ffff88008f6e26c0 3541195649 C Bi:1:004:1 0 4096 = 00000000 00000000 00000000 00000000 00000000 00000000 00000000 00000000
ffff8801373326c0 3541195671 S Bi:1:004:1 -115 13 <
ffff8801373326c0 3541195898 C Bi:1:004:1 0 13 = 55534253 45000000 00000000 00
ffff8801373326c0 3541196008 S Bo:1:004:1 -115 31 = 55534243 46000000 00100000 80000a28 00000001 98000008 00000000 000000
ffff8801373326c0 3541196147 C Bo:1:004:1 0 31 >
ffff88009da98cc0 3541196165 S Bi:1:004:1 -115 4096 <
ffff88009da98cc0 3541207647 C Bi:1:004:1 0 4096 = 00000000 00000000 00000000 00000000 00000000 00000000 00000000 00000000
ffff8801373326c0 3541207666 S Bi:1:004:1 -115 13 <
ffff8801373326c0 3541207897 C Bi:1:004:1 0 13 = 55534253 46000000 00000000 00
ffff8801373326c0 3541207985 S Bo:1:004:1 -115 31 = 55534243 47000000 00100000 80000a28 00000001 a0000008 00000000 000000
ffff8801373326c0 3541208022 C Bo:1:004:1 0 31 >
ffff88009da98300 3541208056 S Bi:1:004:1 -115 4096 <
ffff88009da98300 3541219523 C Bi:1:004:1 0 4096 = 00000000 00000000 00000000 00000000 00000000 00000000 00000000 00000000
ffff8801373326c0 3541219543 S Bi:1:004:1 -115 13 <
ffff8801373326c0 3541219772 C Bi:1:004:1 0 13 = 55534253 47000000 00000000 00
ffff8801373326c0 3541219840 S Bo:1:004:1 -115 31 = 55534243 48000000 00100000 80000a28 00000001 a8000008 00000000 000000
ffff8801373326c0 3541219897 C Bo:1:004:1 0 31 >
ffff88009da98000 3541219913 S Bi:1:004:1 -115 4096 <
ffff88009da98000 3541231397 C Bi:1:004:1 0 4096 = 00000000 00000000 00000000 00000000 00000000 00000000 00000000 00000000
ffff8801373326c0 3541231417 S Bi:1:004:1 -115 13 <
ffff8801373326c0 3541231772 C Bi:1:004:1 0 13 = 55534253 48000000 00000000 00
ffff8801373326c0 3541231839 S Bo:1:004:1 -115 31 = 55534243 49000000 00100000 80000a28 00000001 b0000008 00000000 000000
ffff8801373326c0 3541231897 C Bo:1:004:1 0 31 >
ffff88009da98300 3541231914 S Bi:1:004:1 -115 4096 <
ffff88009da98300 3541243898 C Bi:1:004:1 0 4096 = 00000000 00000000 00000000 00000000 00000000 00000000 00000000 00000000
ffff8801373326c0 3541243918 S Bi:1:004:1 -115 13 <
ffff8801373326c0 3541244147 C Bi:1:004:1 0 13 = 55534253 49000000 00000000 00
ffff8801373326c0 3541244216 S Bo:1:004:1 -115 31 = 55534243 4a000000 00100000 80000a28 00000001 b8000008 00000000 000000
ffff8801373326c0 3541244272 C Bo:1:004:1 0 31 >
ffff88008f6e2f00 3541244289 S Bi:1:004:1 -115 4096 <
ffff88008f6e2f00 3541255897 C Bi:1:004:1 0 4096 = 00000000 00000000 00000000 00000000 00000000 00000000 00000000 00000000
ffff8801373326c0 3541255917 S Bi:1:004:1 -115 13 <
ffff8801373326c0 3541256147 C Bi:1:004:1 0 13 = 55534253 4a000000 00000000 00
ffff8801373326c0 3541256215 S Bo:1:004:1 -115 31 = 55534243 4b000000 00100000 80000a28 00000001 c0000008 00000000 000000
ffff8801373326c0 3541256272 C Bo:1:004:1 0 31 >
ffff88008f6e2780 3541256289 S Bi:1:004:1 -115 4096 <
ffff88008f6e2780 3541268773 C Bi:1:004:1 0 4096 = 00000000 00000000 00000000 00000000 00000000 00000000 00000000 00000000
ffff8801373326c0 3541268792 S Bi:1:004:1 -115 13 <
ffff8801373326c0 3541269022 C Bi:1:004:1 0 13 = 55534253 4b000000 00000000 00
ffff8801373326c0 3541269088 S Bo:1:004:1 -115 31 = 55534243 4c000000 00100000 80000a28 00000001 c8000008 00000000 000000
ffff8801373326c0 3541269147 C Bo:1:004:1 0 31 >
ffff88008f6e2f00 3541269163 S Bi:1:004:1 -115 4096 <
ffff88008f6e2f00 3541281023 C Bi:1:004:1 0 4096 = 00000000 00000000 00000000 00000000 00000000 00000000 00000000 00000000
ffff8801373326c0 3541281043 S Bi:1:004:1 -115 13 <
ffff8801373326c0 3541281522 C Bi:1:004:1 0 13 = 55534253 4c000000 00000000 00
ffff8801373326c0 3541281591 S Bo:1:004:1 -115 31 = 55534243 4d000000 00100000 80000a28 00000001 d0000008 00000000 000000
ffff8801373326c0 3541281647 C Bo:1:004:1 0 31 >
ffff88008f6e26c0 3541281664 S Bi:1:004:1 -115 4096 <
ffff88008f6e26c0 3541293398 C Bi:1:004:1 0 4096 = 00000000 00000000 00000000 00000000 00000000 00000000 00000000 00000000
ffff8801373326c0 3541293419 S Bi:1:004:1 -115 13 <
ffff8801373326c0 3541293647 C Bi:1:004:1 0 13 = 55534253 4d000000 00000000 00
ffff8801373326c0 3541293714 S Bo:1:004:1 -115 31 = 55534243 4e000000 00100000 80000a28 00000001 d8000008 00000000 000000
ffff8801373326c0 3541293772 C Bo:1:004:1 0 31 >
ffff88009da98cc0 3541293789 S Bi:1:004:1 -115 4096 <
ffff88009da98cc0 3541305398 C Bi:1:004:1 0 4096 = 00000000 00000000 00000000 00000000 00000000 00000000 00000000 00000000
ffff8801373326c0 3541305417 S Bi:1:004:1 -115 13 <
ffff8801373326c0 3541305647 C Bi:1:004:1 0 13 = 55534253 4e000000 00000000 00
ffff8801373326c0 3541305714 S Bo:1:004:1 -115 31 = 55534243 4f000000 00100000 80000a28 00000001 e0000008 00000000 000000
ffff8801373326c0 3541305772 C Bo:1:004:1 0 31 >
ffff88009da98d80 3541305788 S Bi:1:004:1 -115 4096 <
ffff88009da98d80 3541317273 C Bi:1:004:1 0 4096 = 00000000 00000000 00000000 00000000 00000000 00000000 00000000 00000000
ffff8801373326c0 3541317292 S Bi:1:004:1 -115 13 <
ffff8801373326c0 3541317647 C Bi:1:004:1 0 13 = 55534253 4f000000 00000000 00
ffff8801373326c0 3541317713 S Bo:1:004:1 -115 31 = 55534243 50000000 00100000 80000a28 00000001 e8000008 00000000 000000
ffff8801373326c0 3541317772 C Bo:1:004:1 0 31 >
ffff88009da98180 3541317788 S Bi:1:004:1 -115 4096 <
ffff88009da98180 3541329523 C Bi:1:004:1 0 4096 = 00000000 00000000 00000000 00000000 00000000 00000000 00000000 00000000
ffff8801373326c0 3541329543 S Bi:1:004:1 -115 13 <
ffff8801373326c0 3541329772 C Bi:1:004:1 0 13 = 55534253 50000000 00000000 00
ffff8801373326c0 3541329839 S Bo:1:004:1 -115 31 = 55534243 51000000 00100000 80000a28 00000001 f0000008 00000000 000000
ffff8801373326c0 3541329897 C Bo:1:004:1 0 31 >
ffff88008f6e2540 3541329913 S Bi:1:004:1 -115 4096 <
ffff88008f6e2540 3541341648 C Bi:1:004:1 0 4096 = 00000000 00000000 00000000 00000000 00000000 00000000 00000000 00000000
ffff8801373326c0 3541341668 S Bi:1:004:1 -115 13 <
ffff8801373326c0 3541341897 C Bi:1:004:1 0 13 = 55534253 51000000 00000000 00
ffff8801373326c0 3541341963 S Bo:1:004:1 -115 31 = 55534243 52000000 00100000 80000a28 00000001 f8000008 00000000 000000
ffff8801373326c0 3541342022 C Bo:1:004:1 0 31 >
ffff88008f6e2c00 3541342038 S Bi:1:004:1 -115 4096 <
ffff88008f6e2c00 3541353522 C Bi:1:004:1 0 4096 = 00000000 00000000 00000000 00000000 00000000 00000000 00000000 00000000
ffff8801373326c0 3541353541 S Bi:1:004:1 -115 13 <
ffff8801373326c0 3541353772 C Bi:1:004:1 0 13 = 55534253 52000000 00000000 00
ffff8801373326c0 3541353838 S Bo:1:004:1 -115 31 = 55534243 53000000 00100000 80000a28 00000003 00000008 00000000 000000
ffff8801373326c0 3541353897 C Bo:1:004:1 0 31 >
ffff88008f6e2480 3541353913 S Bi:1:004:1 -115 4096 <
ffff88008f6e2480 3541365522 C Bi:1:004:1 0 4096 = 00000000 00000000 00000000 00000000 00000000 00000000 00000000 00000000
ffff8801373326c0 3541365542 S Bi:1:004:1 -115 13 <
ffff8801373326c0 3541365772 C Bi:1:004:1 0 13 = 55534253 53000000 00000000 00
ffff8801373326c0 3541365838 S Bo:1:004:1 -115 31 = 55534243 54000000 00100000 80000a28 00000003 08000008 00000000 000000
ffff8801373326c0 3541365897 C Bo:1:004:1 0 31 >
ffff88008f6e23c0 3541365913 S Bi:1:004:1 -115 4096 <
ffff88008f6e23c0 3541377648 C Bi:1:004:1 0 4096 = 00000000 00000000 00000000 00000000 00000000 00000000 00000000 00000000
ffff8801373326c0 3541377668 S Bi:1:004:1 -115 13 <
ffff8801373326c0 3541377897 C Bi:1:004:1 0 13 = 55534253 54000000 00000000 00
ffff8801373326c0 3541377965 S Bo:1:004:1 -115 31 = 55534243 55000000 00100000 80000a28 00000003 10000008 00000000 000000
ffff8801373326c0 3541378022 C Bo:1:004:1 0 31 >
ffff88009da989c0 3541378039 S Bi:1:004:1 -115 4096 <
ffff88009da989c0 3541389773 C Bi:1:004:1 0 4096 = 00000000 00000000 00000000 00000000 00000000 00000000 00000000 00000000
ffff8801373326c0 3541389793 S Bi:1:004:1 -115 13 <
ffff8801373326c0 3541390022 C Bi:1:004:1 0 13 = 55534253 55000000 00000000 00
ffff8801373326c0 3541390089 S Bo:1:004:1 -115 31 = 55534243 56000000 00100000 80000a28 00000003 18000008 00000000 000000
ffff8801373326c0 3541390147 C Bo:1:004:1 0 31 >
ffff88009da98b40 3541390162 S Bi:1:004:1 -115 4096 <
ffff88009da98b40 3541401522 C Bi:1:004:1 0 4096 = 00000000 00000000 00000000 00000000 00000000 00000000 00000000 00000000
ffff8801373326c0 3541401542 S Bi:1:004:1 -115 13 <
ffff8801373326c0 3541401897 C Bi:1:004:1 0 13 = 55534253 56000000 00000000 00
ffff8801373326c0 3541401965 S Bo:1:004:1 -115 31 = 55534243 57000000 00100000 80000a28 00000003 20000008 00000000 000000
ffff8801373326c0 3541402022 C Bo:1:004:1 0 31 >
ffff88009da980c0 3541402038 S Bi:1:004:1 -115 4096 <
ffff88009da980c0 3541415022 C Bi:1:004:1 0 4096 = 00000000 00000000 00000000 00000000 00000000 00000000 00000000 00000000
ffff8801373326c0 3541415043 S Bi:1:004:1 -115 13 <
ffff8801373326c0 3541415272 C Bi:1:004:1 0 13 = 55534253 57000000 00000000 00
ffff8801373326c0 3541415336 S Bo:1:004:1 -115 31 = 55534243 58000000 00100000 80000a28 00000003 28000008 00000000 000000
ffff8801373326c0 3541415397 C Bo:1:004:1 0 31 >
ffff88009da98b40 3541415414 S Bi:1:004:1 -115 4096 <
ffff88009da98b40 3541427272 C Bi:1:004:1 0 4096 = 00000000 00000000 00000000 00000000 00000000 00000000 00000000 00000000
ffff8801373326c0 3541427293 S Bi:1:004:1 -115 13 <
ffff8801373326c0 3541427647 C Bi:1:004:1 0 13 = 55534253 58000000 00000000 00
ffff8801373326c0 3541427714 S Bo:1:004:1 -115 31 = 55534243 59000000 00100000 80000a28 00000003 30000008 00000000 000000
ffff8801373326c0 3541427772 C Bo:1:004:1 0 31 >
ffff88008f6e2300 3541427788 S Bi:1:004:1 -115 4096 <
ffff88008f6e2300 3541439272 C Bi:1:004:1 0 4096 = 00000000 00000000 00000000 00000000 00000000 00000000 00000000 00000000
ffff8801373326c0 3541439292 S Bi:1:004:1 -115 13 <
ffff8801373326c0 3541439522 C Bi:1:004:1 0 13 = 55534253 59000000 00000000 00
ffff8801373326c0 3541439588 S Bo:1:004:1 -115 31 = 55534243 5a000000 00100000 80000a28 00000003 38000008 00000000 000000
ffff8801373326c0 3541439647 C Bo:1:004:1 0 31 >
ffff88008f6e2600 3541439663 S Bi:1:004:1 -115 4096 <
ffff88008f6e2600 3541451647 C Bi:1:004:1 0 4096 = 00000000 00000000 00000000 00000000 00000000 00000000 00000000 00000000
ffff8801373326c0 3541451666 S Bi:1:004:1 -115 13 <
ffff8801373326c0 3541451897 C Bi:1:004:1 0 13 = 55534253 5a000000 00000000 00
ffff8801373326c0 3541451986 S Bo:1:004:1 -115 31 = 55534243 5b000000 00100000 80000a28 00000003 40000008 00000000 000000
ffff8801373326c0 3541452022 C Bo:1:004:1 0 31 >
ffff88009da98e40 3541452129 S Bi:1:004:1 -115 4096 <
ffff88009da98e40 3541463648 C Bi:1:004:1 0 4096 = 00000000 00000000 00000000 00000000 00000000 00000000 00000000 00000000
ffff8801373326c0 3541463667 S Bi:1:004:1 -115 13 <
ffff8801373326c0 3541463897 C Bi:1:004:1 0 13 = 55534253 5b000000 00000000 00
ffff8801373326c0 3541463989 S Bo:1:004:1 -115 31 = 55534243 5c000000 00100000 80000a28 00000003 48000008 00000000 000000
ffff8801373326c0 3541464022 C Bo:1:004:1 0 31 >
ffff88008f6e2600 3541464126 S Bi:1:004:1 -115 4096 <
ffff88008f6e2600 3541475648 C Bi:1:004:1 0 4096 = 00000000 00000000 00000000 00000000 00000000 00000000 00000000 00000000
ffff8801373326c0 3541475668 S Bi:1:004:1 -115 13 <
ffff8801373326c0 3541475897 C Bi:1:004:1 0 13 = 55534253 5c000000 00000000 00
ffff8801373326c0 3541475987 S Bo:1:004:1 -115 31 = 55534243 5d000000 00100000 80000a28 00000003 50000008 00000000 000000
ffff8801373326c0 3541476023 C Bo:1:004:1 0 31 >
ffff88008f6e2480 3541476063 S Bi:1:004:1 -115 4096 <
ffff88008f6e2480 3541487523 C Bi:1:004:1 0 4096 = 00000000 00000000 00000000 00000000 00000000 00000000 00000000 00000000
ffff8801373326c0 3541487543 S Bi:1:004:1 -115 13 <
ffff8801373326c0 3541487772 C Bi:1:004:1 0 13 = 55534253 5d000000 00000000 00
ffff8801373326c0 3541487839 S Bo:1:004:1 -115 31 = 55534243 5e000000 00100000 80000a28 00000003 58000008 00000000 000000
ffff8801373326c0 3541487897 C Bo:1:004:1 0 31 >
ffff88009da98d80 3541487913 S Bi:1:004:1 -115 4096 <
ffff88009da98d80 3541499897 C Bi:1:004:1 0 4096 = 00000000 00000000 00000000 00000000 00000000 00000000 00000000 00000000
ffff8801373326c0 3541499917 S Bi:1:004:1 -115 13 <
ffff8801373326c0 3541500147 C Bi:1:004:1 0 13 = 55534253 5e000000 00000000 00
ffff8801373326c0 3541500214 S Bo:1:004:1 -115 31 = 55534243 5f000000 00100000 80000a28 00000003 60000008 00000000 000000
ffff8801373326c0 3541500272 C Bo:1:004:1 0 31 >
ffff88009da98180 3541500290 S Bi:1:004:1 -115 4096 <
ffff88009da98180 3541511773 C Bi:1:004:1 0 4096 = 00000000 00000000 00000000 00000000 00000000 00000000 00000000 00000000
ffff8801373326c0 3541511793 S Bi:1:004:1 -115 13 <
ffff8801373326c0 3541512022 C Bi:1:004:1 0 13 = 55534253 5f000000 00000000 00
ffff8801373326c0 3541512090 S Bo:1:004:1 -115 31 = 55534243 60000000 00100000 80000a28 00000003 68000008 00000000 000000
ffff8801373326c0 3541512147 C Bo:1:004:1 0 31 >
ffff88009da98cc0 3541512164 S Bi:1:004:1 -115 4096 <
ffff88009da98cc0 3541523649 C Bi:1:004:1 0 4096 = 00000000 00000000 00000000 00000000 00000000 00000000 00000000 00000000
ffff8801373326c0 3541523669 S Bi:1:004:1 -115 13 <
ffff8801373326c0 3541523897 C Bi:1:004:1 0 13 = 55534253 60000000 00000000 00
ffff8801373326c0 3541523987 S Bo:1:004:1 -115 31 = 55534243 61000000 00100000 80000a28 00000003 70000008 00000000 000000
ffff8801373326c0 3541524022 C Bo:1:004:1 0 31 >
ffff88009da98180 3541524137 S Bi:1:004:1 -115 4096 <
ffff88009da98180 3541535522 C Bi:1:004:1 0 4096 = 00000000 00000000 00000000 00000000 00000000 00000000 00000000 00000000
ffff8801373326c0 3541535544 S Bi:1:004:1 -115 13 <
ffff8801373326c0 3541535897 C Bi:1:004:1 0 13 = 55534253 61000000 00000000 00
ffff8801373326c0 3541535992 S Bo:1:004:1 -115 31 = 55534243 62000000 00100000 80000a28 00000003 78000008 00000000 000000
ffff8801373326c0 3541536146 C Bo:1:004:1 0 31 >
ffff88008f6e2540 3541536158 S Bi:1:004:1 -115 4096 <
ffff88008f6e2540 3541547898 C Bi:1:004:1 0 4096 = 00000000 00000000 00000000 00000000 00000000 00000000 00000000 00000000
ffff8801373326c0 3541547918 S Bi:1:004:1 -115 13 <
ffff8801373326c0 3541548147 C Bi:1:004:1 0 13 = 55534253 62000000 00000000 00
ffff8801373326c0 3541548217 S Bo:1:004:1 -115 31 = 55534243 63000000 00100000 80000a28 00000003 80000008 00000000 000000
ffff8801373326c0 3541548272 C Bo:1:004:1 0 31 >
ffff88008f6e2b40 3541548289 S Bi:1:004:1 -115 4096 <
ffff88008f6e2b40 3541562774 C Bi:1:004:1 0 4096 = 00000000 00000000 00000000 00000000 00000000 00000000 00000000 00000000
ffff8801373326c0 3541562794 S Bi:1:004:1 -115 13 <
ffff8801373326c0 3541563022 C Bi:1:004:1 0 13 = 55534253 63000000 00000000 00
ffff8801373326c0 3541563091 S Bo:1:004:1 -115 31 = 55534243 64000000 00100000 80000a28 00000003 88000008 00000000 000000
ffff8801373326c0 3541563147 C Bo:1:004:1 0 31 >
ffff88008f6e26c0 3541563164 S Bi:1:004:1 -115 4096 <
ffff88008f6e26c0 3541575524 C Bi:1:004:1 0 4096 = 00000000 00000000 00000000 00000000 00000000 00000000 00000000 00000000
ffff8801373326c0 3541575545 S Bi:1:004:1 -115 13 <
ffff8801373326c0 3541575647 C Bi:1:004:1 0 13 = 55534253 64000000 00000000 00
ffff8801373326c0 3541575722 S Bo:1:004:1 -115 31 = 55534243 65000000 00100000 80000a28 00000003 90000008 00000000 000000
ffff8801373326c0 3541575772 C Bo:1:004:1 0 31 >
ffff88009da98300 3541575789 S Bi:1:004:1 -115 4096 <
ffff88009da98300 3541591274 C Bi:1:004:1 0 4096 = 00000000 00000000 00000000 00000000 00000000 00000000 00000000 00000000
ffff8801373326c0 3541591295 S Bi:1:004:1 -115 13 <
ffff8801373326c0 3541591397 C Bi:1:004:1 0 13 = 55534253 65000000 00000000 00
ffff8801373326c0 3541591466 S Bo:1:004:1 -115 31 = 55534243 66000000 00100000 80000a28 00000003 98000008 00000000 000000
ffff8801373326c0 3541591522 C Bo:1:004:1 0 31 >
ffff88009da98180 3541591538 S Bi:1:004:1 -115 4096 <
ffff88009da98180 3541602898 C Bi:1:004:1 0 4096 = 00000000 00000000 00000000 00000000 00000000 00000000 00000000 00000000
ffff8801373326c0 3541602920 S Bi:1:004:1 -115 13 <
ffff8801373326c0 3541603147 C Bi:1:004:1 0 13 = 55534253 66000000 00000000 00
ffff8801373326c0 3541603216 S Bo:1:004:1 -115 31 = 55534243 67000000 00100000 80000a28 00000003 a0000008 00000000 000000
ffff8801373326c0 3541603272 C Bo:1:004:1 0 31 >
ffff88008f6e2780 3541603289 S Bi:1:004:1 -115 4096 <
ffff88008f6e2780 3541615273 C Bi:1:004:1 0 4096 = 00000000 00000000 00000000 00000000 00000000 00000000 00000000 00000000
ffff8801373326c0 3541615293 S Bi:1:004:1 -115 13 <
ffff8801373326c0 3541615522 C Bi:1:004:1 0 13 = 55534253 67000000 00000000 00
ffff8801373326c0 3541615591 S Bo:1:004:1 -115 31 = 55534243 68000000 00100000 80000a28 00000003 a8000008 00000000 000000
ffff8801373326c0 3541615647 C Bo:1:004:1 0 31 >
ffff88008f6e2f00 3541615664 S Bi:1:004:1 -115 4096 <
ffff88008f6e2f00 3541627273 C Bi:1:004:1 0 4096 = 00000000 00000000 00000000 00000000 00000000 00000000 00000000 00000000
ffff8801373326c0 3541627293 S Bi:1:004:1 -115 13 <
ffff8801373326c0 3541627522 C Bi:1:004:1 0 13 = 55534253 68000000 00000000 00
ffff8801373326c0 3541627591 S Bo:1:004:1 -115 31 = 55534243 69000000 00100000 80000a28 00000003 b0000008 00000000 000000
ffff8801373326c0 3541627647 C Bo:1:004:1 0 31 >
ffff88008f6e2780 3541627664 S Bi:1:004:1 -115 4096 <
ffff88008f6e2780 3541639273 C Bi:1:004:1 0 4096 = 00000000 00000000 00000000 00000000 00000000 00000000 00000000 00000000
ffff8801373326c0 3541639294 S Bi:1:004:1 -115 13 <
ffff8801373326c0 3541639522 C Bi:1:004:1 0 13 = 55534253 69000000 00000000 00
ffff8801373326c0 3541639591 S Bo:1:004:1 -115 31 = 55534243 6a000000 00100000 80000a28 00000003 b8000008 00000000 000000
ffff8801373326c0 3541639647 C Bo:1:004:1 0 31 >
ffff88009da98cc0 3541639663 S Bi:1:004:1 -115 4096 <
ffff88009da98cc0 3541651022 C Bi:1:004:1 0 4096 = 00000000 00000000 00000000 00000000 00000000 00000000 00000000 00000000
ffff8801373326c0 3541651043 S Bi:1:004:1 -115 13 <
ffff8801373326c0 3541651397 C Bi:1:004:1 0 13 = 55534253 6a000000 00000000 00
ffff8801373326c0 3541651467 S Bo:1:004:1 -115 31 = 55534243 6b000000 00100000 80000a28 00000003 c0000008 00000000 000000
ffff8801373326c0 3541651522 C Bo:1:004:1 0 31 >
ffff88008f6e2b40 3541651539 S Bi:1:004:1 -115 4096 <
ffff88008f6e2b40 3541679149 C Bi:1:004:1 0 4096 = 00000000 00000000 00000000 00000000 00000000 00000000 00000000 00000000
ffff8801373326c0 3541679171 S Bi:1:004:1 -115 13 <
ffff8801373326c0 3541679272 C Bi:1:004:1 0 13 = 55534253 6b000000 00000000 00
ffff8801373326c0 3541679352 S Bo:1:004:1 -115 31 = 55534243 6c000000 00100000 80000a28 00000003 c8000008 00000000 000000
ffff8801373326c0 3541679397 C Bo:1:004:1 0 31 >
ffff88008f6e2b40 3541679414 S Bi:1:004:1 -115 4096 <
ffff88008f6e2b40 3541691148 C Bi:1:004:1 0 4096 = 00000000 00000000 00000000 00000000 00000000 00000000 00000000 00000000
ffff8801373326c0 3541691170 S Bi:1:004:1 -115 13 <
ffff8801373326c0 3541691523 C Bi:1:004:1 0 13 = 55534253 6c000000 00000000 00
ffff8801373326c0 3541691595 S Bo:1:004:1 -115 31 = 55534243 6d000000 00100000 80000a28 00000003 d0000008 00000000 000000
ffff8801373326c0 3541691648 C Bo:1:004:1 0 31 >
ffff88009da98d80 3541691664 S Bi:1:004:1 -115 4096 <
ffff88009da98d80 3541703147 C Bi:1:004:1 0 4096 = 00000000 00000000 00000000 00000000 00000000 00000000 00000000 00000000
ffff8801373326c0 3541703168 S Bi:1:004:1 -115 13 <
ffff8801373326c0 3541703397 C Bi:1:004:1 0 13 = 55534253 6d000000 00000000 00
ffff8801373326c0 3541703468 S Bo:1:004:1 -115 31 = 55534243 6e000000 00100000 80000a28 00000003 d8000008 00000000 000000
ffff8801373326c0 3541703522 C Bo:1:004:1 0 31 >
ffff88007d8d9f00 3541703539 S Bi:1:004:1 -115 4096 <
ffff88007d8d9f00 3541715023 C Bi:1:004:1 0 4096 = 00000000 00000000 00000000 00000000 00000000 00000000 00000000 00000000
ffff8801373326c0 3541715045 S Bi:1:004:1 -115 13 <
ffff8801373326c0 3541715272 C Bi:1:004:1 0 13 = 55534253 6e000000 00000000 00
ffff8801373326c0 3541715343 S Bo:1:004:1 -115 31 = 55534243 6f000000 00100000 80000a28 00000003 e0000008 00000000 000000
ffff8801373326c0 3541715397 C Bo:1:004:1 0 31 >
ffff88009da989c0 3541715413 S Bi:1:004:1 -115 4096 <
ffff88009da989c0 3541727273 C Bi:1:004:1 0 4096 = 00000000 00000000 00000000 00000000 00000000 00000000 00000000 00000000
ffff8801373326c0 3541727295 S Bi:1:004:1 -115 13 <
ffff8801373326c0 3541727522 C Bi:1:004:1 0 13 = 55534253 6f000000 00000000 00
ffff8801373326c0 3541727592 S Bo:1:004:1 -115 31 = 55534243 70000000 00100000 80000a28 00000003 e8000008 00000000 000000
ffff8801373326c0 3541727647 C Bo:1:004:1 0 31 >
ffff88007d8d9540 3541727664 S Bi:1:004:1 -115 4096 <
ffff88007d8d9540 3541739272 C Bi:1:004:1 0 4096 = 00000000 00000000 00000000 00000000 00000000 00000000 00000000 00000000
ffff8801373326c0 3541739298 S Bi:1:004:1 -115 13 <
ffff8801373326c0 3541739396 C Bi:1:004:1 0 13 = 55534253 70000000 00000000 00
ffff8801373326c0 3541739454 S Bo:1:004:1 -115 31 = 55534243 71000000 00100000 80000a28 00000003 f0000008 00000000 000000
ffff8801373326c0 3541739521 C Bo:1:004:1 0 31 >
ffff88009da980c0 3541739538 S Bi:1:004:1 -115 4096 <
ffff88009da980c0 3541750898 C Bi:1:004:1 0 4096 = 00000000 00000000 00000000 00000000 00000000 00000000 00000000 00000000
ffff8801373326c0 3541750919 S Bi:1:004:1 -115 13 <
ffff8801373326c0 3541751147 C Bi:1:004:1 0 13 = 55534253 71000000 00000000 00
ffff8801373326c0 3541751217 S Bo:1:004:1 -115 31 = 55534243 72000000 00100000 80000a28 00000003 f8000008 00000000 000000
ffff8801373326c0 3541751272 C Bo:1:004:1 0 31 >
ffff88009da98e40 3541751289 S Bi:1:004:1 -115 4096 <
ffff88009da98e40 3541762898 C Bi:1:004:1 0 4096 = 00000000 00000000 00000000 00000000 00000000 00000000 00000000 00000000
ffff8801373326c0 3541762918 S Bi:1:004:1 -115 13 <
ffff8801373326c0 3541763023 C Bi:1:004:1 0 13 = 55534253 72000000 00000000 00
ffff8801373326c0 3541763111 S Bo:1:004:1 -115 31 = 55534243 73000000 00100000 80000a28 00000002 00000008 00000000 000000
ffff8801373326c0 3541763147 C Bo:1:004:1 0 31 >
ffff88009da98b40 3541763164 S Bi:1:004:1 -115 4096 <
ffff88009da98b40 3541774898 C Bi:1:004:1 0 4096 = 00000000 00000000 00000000 00000000 00000000 00000000 00000000 00000000
ffff8801373326c0 3541774920 S Bi:1:004:1 -115 13 <
ffff8801373326c0 3541775273 C Bi:1:004:1 0 13 = 55534253 73000000 00000000 00
ffff8801373326c0 3541775349 S Bo:1:004:1 -115 31 = 55534243 74000000 00100000 80000a28 00000000 20000008 00000000 000000
ffff8801373326c0 3541775397 C Bo:1:004:1 0 31 >
ffff88007d8d9900 3541775414 S Bi:1:004:1 -115 4096 <
ffff88007d8d9900 3541787648 C Bi:1:004:1 0 4096 = 00000000 00000000 00000000 00000000 00000000 00000000 00000000 00000000
ffff8801373326c0 3541787669 S Bi:1:004:1 -115 13 <
ffff8801373326c0 3541787898 C Bi:1:004:1 0 13 = 55534253 74000000 00000000 00
ffff8801373326c0 3541788010 S Bo:1:004:1 -115 31 = 55534243 75000000 00100000 80000a28 00000010 00000008 00000000 000000
ffff8801373326c0 3541788271 C Bo:1:004:1 0 31 >
ffff88007d8d9c00 3541788282 S Bi:1:004:1 -115 4096 <
ffff88007d8d9c00 3541801274 C Bi:1:004:1 0 4096 = 00000000 00000000 00000000 00000000 00000000 00000000 00000000 00000000
ffff8801373326c0 3541801296 S Bi:1:004:1 -115 13 <
ffff8801373326c0 3541801522 C Bi:1:004:1 0 13 = 55534253 75000000 00000000 00
ffff8801373326c0 3541801648 S Bo:1:004:1 -115 31 = 55534243 76000000 00000000 00000600 00000000 00000000 00000000 000000
ffff8801373326c0 3541801773 C Bo:1:004:1 0 31 >
ffff8801373326c0 3541801840 S Bi:1:004:1 -115 13 <
ffff8801373326c0 3541802022 C Bi:1:004:1 0 13 = 55534253 76000000 00000000 00
ffff8801373326c0 3541802069 S Bo:1:004:1 -115 31 = 55534243 77000000 00000000 0000061e 00000000 00000000 00000000 000000
ffff8801373326c0 3541802147 C Bo:1:004:1 0 31 >
ffff8801373326c0 3541802166 S Bi:1:004:1 -115 13 <
ffff8801373326c0 3541802522 C Bi:1:004:1 0 13 = 55534253 77000000 00000000 00
ffff8801373326c0 3541807563 S Bo:1:004:1 -115 31 = 55534243 78000000 00000000 00000600 00000000 00000000 00000000 000000
ffff8801373326c0 3541807653 C Bo:1:004:1 0 31 >
ffff8801373326c0 3541807685 S Bi:1:004:1 -115 13 <
ffff8801373326c0 3541807897 C Bi:1:004:1 0 13 = 55534253 78000000 00000000 00
ffff8801373326c0 3541808426 S Bo:1:004:1 -115 31 = 55534243 79000000 00000000 0000061e 00000001 00000000 00000000 000000
ffff8801373326c0 3541808524 C Bo:1:004:1 0 31 >
ffff8801373326c0 3541808541 S Bi:1:004:1 -115 13 <
ffff8801373326c0 3541808773 C Bi:1:004:1 0 13 = 55534253 79000000 00000000 00
ffff8801373326c0 3541808844 S Bo:1:004:1 -115 31 = 55534243 7a000000 00000000 0000061e 00000000 00000000 00000000 000000
ffff8801373326c0 3541808897 C Bo:1:004:1 0 31 >
ffff8801373326c0 3541808913 S Bi:1:004:1 -115 13 <
ffff8801373326c0 3541809272 C Bi:1:004:1 0 13 = 55534253 7a000000 00000000 00
ffff8801373326c0 3541809319 S Bo:1:004:1 -115 31 = 55534243 7b000000 00000000 00000600 00000000 00000000 00000000 000000
ffff8801373326c0 3541809397 C Bo:1:004:1 0 31 >
ffff8801373326c0 3541809412 S Bi:1:004:1 -115 13 <
ffff8801373326c0 3541809773 C Bi:1:004:1 0 13 = 55534253 7b000000 00000000 00
ffff8801373326c0 3541810140 S Bo:1:004:1 -115 31 = 55534243 7c000000 00000000 00000600 00000000 00000000 00000000 000000
ffff8801373326c0 3541810272 C Bo:1:004:1 0 31 >
ffff8801373326c0 3541810522 S Bi:1:004:1 -115 13 <
ffff8801373326c0 3541810648 C Bi:1:004:1 0 13 = 55534253 7c000000 00000000 00
ffff8801373326c0 3541810702 S Bo:1:004:1 -115 31 = 55534243 7d000000 00000000 0000061e 00000001 00000000 00000000 000000
ffff8801373326c0 3541810772 C Bo:1:004:1 0 31 >
ffff8801373326c0 3541810792 S Bi:1:004:1 -115 13 <
ffff8801373326c0 3541811022 C Bi:1:004:1 0 13 = 55534253 7d000000 00000000 00
ffff8801373326c0 3541811082 S Bo:1:004:1 -115 31 = 55534243 7e000000 00000000 0000061e 00000000 00000000 00000000 000000
ffff8801373326c0 3541811147 C Bo:1:004:1 0 31 >
ffff8801373326c0 3541811165 S Bi:1:004:1 -115 13 <
ffff8801373326c0 3541811522 C Bi:1:004:1 0 13 = 55534253 7e000000 00000000 00
ffff8801373326c0 3541811568 S Bo:1:004:1 -115 31 = 55534243 7f000000 00000000 00000600 00000000 00000000 00000000 000000
ffff8801373326c0 3541811647 C Bo:1:004:1 0 31 >
ffff8801373326c0 3541811662 S Bi:1:004:1 -115 13 <
ffff8801373326c0 3541811897 C Bi:1:004:1 0 13 = 55534253 7f000000 00000000 00
ffff8801373326c0 3541965633 S Bo:1:004:1 -115 31 = 55534243 80000000 00000000 00000600 00000000 00000000 00000000 000000
ffff8801373326c0 3541965777 C Bo:1:004:1 0 31 >
ffff8801373326c0 3541965799 S Bi:1:004:1 -115 13 <
ffff8801373326c0 3541965898 C Bi:1:004:1 0 13 = 55534253 80000000 00000000 00
ffff8801373326c0 3541965958 S Bo:1:004:1 -115 31 = 55534243 81000000 00000000 0000061e 00000001 00000000 00000000 000000
ffff8801373326c0 3541966022 C Bo:1:004:1 0 31 >
ffff8801373326c0 3541966040 S Bi:1:004:1 -115 13 <
ffff8801373326c0 3541966273 C Bi:1:004:1 0 13 = 55534253 81000000 00000000 00
ffff8801373326c0 3541966359 S Bo:1:004:1 -115 31 = 55534243 82000000 00020000 80000a28 00000000 00000001 00000000 000000
ffff8801373326c0 3541966397 C Bo:1:004:1 0 31 >
ffff88008f5ea300 3541966414 S Bi:1:004:1 -115 512 <
ffff88008f5ea300 3541980526 C Bi:1:004:1 0 512 = eb3c906d 6b646f73 66730000 02040100 02000200 00f88000 20004000 00000000
ffff8801373326c0 3541980548 S Bi:1:004:1 -115 13 <
ffff8801373326c0 3541980647 C Bi:1:004:1 0 13 = 55534253 82000000 00000000 00
ffff8801373326c0 3542014345 S Bo:1:004:1 -115 31 = 55534243 83000000 00020000 80000a28 00000001 01000001 00000000 000000
ffff8801373326c0 3542014399 C Bo:1:004:1 0 31 >
ffff88008f5ea6c0 3542014484 S Bi:1:004:1 -115 512 <
ffff88008f5ea6c0 3542026275 C Bi:1:004:1 0 512 = 41640061 00760065 0074000f 006b6900 0000ffff ffffffff ffff0000 ffffffff
ffff8801373326c0 3542026299 S Bi:1:004:1 -115 13 <
ffff8801373326c0 3542026397 C Bi:1:004:1 0 13 = 55534253 83000000 00000000 00
ffff8801373326c0 3542026472 S Bo:1:004:1 -115 31 = 55534243 84000000 00020000 80000a28 00000001 02000001 00000000 000000
ffff8801373326c0 3542026522 C Bo:1:004:1 0 31 >
ffff88008f48da80 3542026539 S Bi:1:004:1 -115 512 <
ffff88008f48da80 3542038024 C Bi:1:004:1 0 512 = 00000000 00000000 00000000 00000000 00000000 00000000 00000000 00000000
ffff8801373326c0 3542038046 S Bi:1:004:1 -115 13 <
ffff8801373326c0 3542038147 C Bi:1:004:1 0 13 = 55534253 84000000 00000000 00
ffff8801373326c0 3542038214 S Bo:1:004:1 -115 31 = 55534243 85000000 00020000 80000a28 00000001 03000001 00000000 000000
ffff8801373326c0 3542038272 C Bo:1:004:1 0 31 >
ffff88008f6d2a80 3542038289 S Bi:1:004:1 -115 512 <
ffff88008f6d2a80 3542049649 C Bi:1:004:1 0 512 = 00000000 00000000 00000000 00000000 00000000 00000000 00000000 00000000
ffff8801373326c0 3542049669 S Bi:1:004:1 -115 13 <
ffff8801373326c0 3542049772 C Bi:1:004:1 0 13 = 55534253 85000000 00000000 00
ffff8801373326c0 3542049829 S Bo:1:004:1 -115 31 = 55534243 86000000 00020000 80000a28 00000001 04000001 00000000 000000
ffff8801373326c0 3542049897 C Bo:1:004:1 0 31 >
ffff88008f6d2f00 3542049914 S Bi:1:004:1 -115 512 <
ffff88008f6d2f00 3542061399 C Bi:1:004:1 0 512 = 00000000 00000000 00000000 00000000 00000000 00000000 00000000 00000000
ffff8801373326c0 3542061421 S Bi:1:004:1 -115 13 <
ffff8801373326c0 3542061523 C Bi:1:004:1 0 13 = 55534253 86000000 00000000 00
ffff8801373326c0 3542061586 S Bo:1:004:1 -115 31 = 55534243 87000000 00020000 80000a28 00000001 05000001 00000000 000000
ffff8801373326c0 3542061647 C Bo:1:004:1 0 31 >
ffff88009a7ef540 3542061664 S Bi:1:004:1 -115 512 <
ffff88009a7ef540 3542073025 C Bi:1:004:1 0 512 = 00000000 00000000 00000000 00000000 00000000 00000000 00000000 00000000
ffff8801373326c0 3542073047 S Bi:1:004:1 -115 13 <
ffff8801373326c0 3542073147 C Bi:1:004:1 0 13 = 55534253 87000000 00000000 00
ffff8801373326c0 3542073206 S Bo:1:004:1 -115 31 = 55534243 88000000 00020000 80000a28 00000001 06000001 00000000 000000
ffff8801373326c0 3542073272 C Bo:1:004:1 0 31 >
ffff88009a7ef180 3542073289 S Bi:1:004:1 -115 512 <
ffff88009a7ef180 3542084647 C Bi:1:004:1 0 512 = 00000000 00000000 00000000 00000000 00000000 00000000 00000000 00000000
ffff8801373326c0 3542084662 S Bi:1:004:1 -115 13 <
ffff8801373326c0 3542084772 C Bi:1:004:1 0 13 = 55534253 88000000 00000000 00
ffff8801373326c0 3542084816 S Bo:1:004:1 -115 31 = 55534243 89000000 00020000 80000a28 00000001 07000001 00000000 000000
ffff8801373326c0 3542084896 C Bo:1:004:1 0 31 >
ffff88009a7ef180 3542084928 S Bi:1:004:1 -115 512 <
ffff88009a7ef180 3542096279 C Bi:1:004:1 0 512 = 00000000 00000000 00000000 00000000 00000000 00000000 00000000 00000000
ffff8801373326c0 3542096297 S Bi:1:004:1 -115 13 <
ffff8801373326c0 3542096397 C Bi:1:004:1 0 13 = 55534253 89000000 00000000 00
ffff8801373326c0 3542096465 S Bo:1:004:1 -115 31 = 55534243 8a000000 00020000 80000a28 00000001 08000001 00000000 000000
ffff8801373326c0 3542096526 C Bo:1:004:1 0 31 >
ffff88009a7ef180 3542096541 S Bi:1:004:1 -115 512 <
ffff88009a7ef180 3542108025 C Bi:1:004:1 0 512 = 00000000 00000000 00000000 00000000 00000000 00000000 00000000 00000000
ffff8801373326c0 3542108047 S Bi:1:004:1 -115 13 <
ffff8801373326c0 3542108148 C Bi:1:004:1 0 13 = 55534253 8a000000 00000000 00
ffff8801373326c0 3542108212 S Bo:1:004:1 -115 31 = 55534243 8b000000 00020000 80000a28 00000001 09000001 00000000 000000
ffff8801373326c0 3542108273 C Bo:1:004:1 0 31 >
ffff88008f6d2900 3542108289 S Bi:1:004:1 -115 512 <
ffff88008f6d2900 3542119649 C Bi:1:004:1 0 512 = 00000000 00000000 00000000 00000000 00000000 00000000 00000000 00000000
ffff8801373326c0 3542119671 S Bi:1:004:1 -115 13 <
ffff8801373326c0 3542119772 C Bi:1:004:1 0 13 = 55534253 8b000000 00000000 00
ffff8801373326c0 3542119826 S Bo:1:004:1 -115 31 = 55534243 8c000000 00020000 80000a28 00000001 0a000001 00000000 000000
ffff8801373326c0 3542119896 C Bo:1:004:1 0 31 >
ffff88008f713b40 3542119911 S Bi:1:004:1 -115 512 <
ffff88008f713b40 3542131274 C Bi:1:004:1 0 512 = 00000000 00000000 00000000 00000000 00000000 00000000 00000000 00000000
ffff8801373326c0 3542131295 S Bi:1:004:1 -115 13 <
ffff8801373326c0 3542131398 C Bi:1:004:1 0 13 = 55534253 8c000000 00000000 00
ffff8801373326c0 3542131461 S Bo:1:004:1 -115 31 = 55534243 8d000000 00020000 80000a28 00000001 0b000001 00000000 000000
ffff8801373326c0 3542131523 C Bo:1:004:1 0 31 >
ffff88008f5ea6c0 3542131539 S Bi:1:004:1 -115 512 <
ffff88008f5ea6c0 3542142650 C Bi:1:004:1 0 512 = 00000000 00000000 00000000 00000000 00000000 00000000 00000000 00000000
ffff8801373326c0 3542142671 S Bi:1:004:1 -115 13 <
ffff8801373326c0 3542142772 C Bi:1:004:1 0 13 = 55534253 8d000000 00000000 00
ffff8801373326c0 3542142836 S Bo:1:004:1 -115 31 = 55534243 8e000000 00020000 80000a28 00000001 0c000001 00000000 000000
ffff8801373326c0 3542142897 C Bo:1:004:1 0 31 >
ffff88008f6d2cc0 3542142914 S Bi:1:004:1 -115 512 <
ffff88008f6d2cc0 3542154899 C Bi:1:004:1 0 512 = 00000000 00000000 00000000 00000000 00000000 00000000 00000000 00000000
ffff8801373326c0 3542154919 S Bi:1:004:1 -115 13 <
ffff8801373326c0 3542155023 C Bi:1:004:1 0 13 = 55534253 8e000000 00000000 00
ffff8801373326c0 3542155086 S Bo:1:004:1 -115 31 = 55534243 8f000000 00020000 80000a28 00000001 0d000001 00000000 000000
ffff8801373326c0 3542155147 C Bo:1:004:1 0 31 >
ffff88008f6d2300 3542155164 S Bi:1:004:1 -115 512 <
ffff88008f6d2300 3542166523 C Bi:1:004:1 0 512 = 00000000 00000000 00000000 00000000 00000000 00000000 00000000 00000000
ffff8801373326c0 3542166543 S Bi:1:004:1 -115 13 <
ffff8801373326c0 3542166647 C Bi:1:004:1 0 13 = 55534253 8f000000 00000000 00
ffff8801373326c0 3542166708 S Bo:1:004:1 -115 31 = 55534243 90000000 00020000 80000a28 00000001 0e000001 00000000 000000
ffff8801373326c0 3542166772 C Bo:1:004:1 0 31 >
ffff88008f6d2cc0 3542166789 S Bi:1:004:1 -115 512 <
ffff88008f6d2cc0 3542178148 C Bi:1:004:1 0 512 = 00000000 00000000 00000000 00000000 00000000 00000000 00000000 00000000
ffff8801373326c0 3542178169 S Bi:1:004:1 -115 13 <
ffff8801373326c0 3542178272 C Bi:1:004:1 0 13 = 55534253 90000000 00000000 00
ffff8801373326c0 3542178335 S Bo:1:004:1 -115 31 = 55534243 91000000 00020000 80000a28 00000001 0f000001 00000000 000000
ffff8801373326c0 3542178397 C Bo:1:004:1 0 31 >
ffff88013730be40 3542178414 S Bi:1:004:1 -115 512 <
ffff88013730be40 3542189649 C Bi:1:004:1 0 512 = 00000000 00000000 00000000 00000000 00000000 00000000 00000000 00000000
ffff8801373326c0 3542189669 S Bi:1:004:1 -115 13 <
ffff8801373326c0 3542189772 C Bi:1:004:1 0 13 = 55534253 91000000 00000000 00
ffff8801373326c0 3542189833 S Bo:1:004:1 -115 31 = 55534243 92000000 00020000 80000a28 00000001 10000001 00000000 000000
ffff8801373326c0 3542189897 C Bo:1:004:1 0 31 >
ffff88013730bc00 3542189914 S Bi:1:004:1 -115 512 <
ffff88013730bc00 3542201524 C Bi:1:004:1 0 512 = 00000000 00000000 00000000 00000000 00000000 00000000 00000000 00000000
ffff8801373326c0 3542201544 S Bi:1:004:1 -115 13 <
ffff8801373326c0 3542201647 C Bi:1:004:1 0 13 = 55534253 92000000 00000000 00
ffff8801373326c0 3542201711 S Bo:1:004:1 -115 31 = 55534243 93000000 00020000 80000a28 00000001 11000001 00000000 000000
ffff8801373326c0 3542201773 C Bo:1:004:1 0 31 >
ffff88008f6d2300 3542201788 S Bi:1:004:1 -115 512 <
ffff88008f6d2300 3542213024 C Bi:1:004:1 0 512 = 00000000 00000000 00000000 00000000 00000000 00000000 00000000 00000000
ffff8801373326c0 3542213044 S Bi:1:004:1 -115 13 <
ffff8801373326c0 3542213147 C Bi:1:004:1 0 13 = 55534253 93000000 00000000 00
ffff8801373326c0 3542213210 S Bo:1:004:1 -115 31 = 55534243 94000000 00020000 80000a28 00000001 12000001 00000000 000000
ffff8801373326c0 3542213271 C Bo:1:004:1 0 31 >
ffff88013730be40 3542213283 S Bi:1:004:1 -115 512 <
ffff88013730be40 3542224649 C Bi:1:004:1 0 512 = 00000000 00000000 00000000 00000000 00000000 00000000 00000000 00000000
ffff8801373326c0 3542224670 S Bi:1:004:1 -115 13 <
ffff8801373326c0 3542224772 C Bi:1:004:1 0 13 = 55534253 94000000 00000000 00
ffff8801373326c0 3542224835 S Bo:1:004:1 -115 31 = 55534243 95000000 00020000 80000a28 00000001 13000001 00000000 000000
ffff8801373326c0 3542224898 C Bo:1:004:1 0 31 >
ffff88008f6d2a80 3542224914 S Bi:1:004:1 -115 512 <
ffff88008f6d2a80 3542236149 C Bi:1:004:1 0 512 = 00000000 00000000 00000000 00000000 00000000 00000000 00000000 00000000
ffff8801373326c0 3542236170 S Bi:1:004:1 -115 13 <
ffff8801373326c0 3542236273 C Bi:1:004:1 0 13 = 55534253 95000000 00000000 00
ffff8801373326c0 3542236335 S Bo:1:004:1 -115 31 = 55534243 96000000 00020000 80000a28 00000001 14000001 00000000 000000
ffff8801373326c0 3542236397 C Bo:1:004:1 0 31 >
ffff88013730bf00 3542236413 S Bi:1:004:1 -115 512 <
ffff88013730bf00 3542248274 C Bi:1:004:1 0 512 = 00000000 00000000 00000000 00000000 00000000 00000000 00000000 00000000
ffff8801373326c0 3542248294 S Bi:1:004:1 -115 13 <
ffff8801373326c0 3542248398 C Bi:1:004:1 0 13 = 55534253 96000000 00000000 00
ffff8801373326c0 3542248459 S Bo:1:004:1 -115 31 = 55534243 97000000 00020000 80000a28 00000001 15000001 00000000 000000
ffff8801373326c0 3542248522 C Bo:1:004:1 0 31 >
ffff88013730ba80 3542248539 S Bi:1:004:1 -115 512 <
ffff88013730ba80 3542259773 C Bi:1:004:1 0 512 = 00000000 00000000 00000000 00000000 00000000 00000000 00000000 00000000
ffff8801373326c0 3542259794 S Bi:1:004:1 -115 13 <
ffff8801373326c0 3542259897 C Bi:1:004:1 0 13 = 55534253 97000000 00000000 00
ffff8801373326c0 3542259981 S Bo:1:004:1 -115 31 = 55534243 98000000 00020000 80000a28 00000001 16000001 00000000 000000
ffff8801373326c0 3542260021 C Bo:1:004:1 0 31 >
ffff88008f6d2480 3542260033 S Bi:1:004:1 -115 512 <
ffff88008f6d2480 3542271398 C Bi:1:004:1 0 512 = 00000000 00000000 00000000 00000000 00000000 00000000 00000000 00000000
ffff8801373326c0 3542271419 S Bi:1:004:1 -115 13 <
ffff8801373326c0 3542271522 C Bi:1:004:1 0 13 = 55534253 98000000 00000000 00
ffff8801373326c0 3542271585 S Bo:1:004:1 -115 31 = 55534243 99000000 00020000 80000a28 00000001 17000001 00000000 000000
ffff8801373326c0 3542271648 C Bo:1:004:1 0 31 >
ffff88008f6d2900 3542271664 S Bi:1:004:1 -115 512 <
ffff88008f6d2900 3542282899 C Bi:1:004:1 0 512 = 00000000 00000000 00000000 00000000 00000000 00000000 00000000 00000000
ffff8801373326c0 3542282919 S Bi:1:004:1 -115 13 <
ffff8801373326c0 3542283022 C Bi:1:004:1 0 13 = 55534253 99000000 00000000 00
ffff8801373326c0 3542283087 S Bo:1:004:1 -115 31 = 55534243 9a000000 00020000 80000a28 00000001 18000001 00000000 000000
ffff8801373326c0 3542283147 C Bo:1:004:1 0 31 >
ffff88008f6d2f00 3542283164 S Bi:1:004:1 -115 512 <
ffff88008f6d2f00 3542294898 C Bi:1:004:1 0 512 = 00000000 00000000 00000000 00000000 00000000 00000000 00000000 00000000
ffff8801373326c0 3542294918 S Bi:1:004:1 -115 13 <
ffff8801373326c0 3542295023 C Bi:1:004:1 0 13 = 55534253 9a000000 00000000 00
ffff8801373326c0 3542295085 S Bo:1:004:1 -115 31 = 55534243 9b000000 00020000 80000a28 00000001 19000001 00000000 000000
ffff8801373326c0 3542295147 C Bo:1:004:1 0 31 >
ffff88008f6d20c0 3542295164 S Bi:1:004:1 -115 512 <
ffff88008f6d20c0 3542306524 C Bi:1:004:1 0 512 = 00000000 00000000 00000000 00000000 00000000 00000000 00000000 00000000
ffff8801373326c0 3542306546 S Bi:1:004:1 -115 13 <
ffff8801373326c0 3542306647 C Bi:1:004:1 0 13 = 55534253 9b000000 00000000 00
ffff8801373326c0 3542306710 S Bo:1:004:1 -115 31 = 55534243 9c000000 00020000 80000a28 00000001 1a000001 00000000 000000
ffff8801373326c0 3542306772 C Bo:1:004:1 0 31 >
ffff88013730bb40 3542306789 S Bi:1:004:1 -115 512 <
ffff88013730bb40 3542318148 C Bi:1:004:1 0 512 = 00000000 00000000 00000000 00000000 00000000 00000000 00000000 00000000
ffff8801373326c0 3542318169 S Bi:1:004:1 -115 13 <
ffff8801373326c0 3542318273 C Bi:1:004:1 0 13 = 55534253 9c000000 00000000 00
ffff8801373326c0 3542318335 S Bo:1:004:1 -115 31 = 55534243 9d000000 00020000 80000a28 00000001 1b000001 00000000 000000
ffff8801373326c0 3542318397 C Bo:1:004:1 0 31 >
ffff88008f6d2780 3542318414 S Bi:1:004:1 -115 512 <
ffff88008f6d2780 3542329774 C Bi:1:004:1 0 512 = 00000000 00000000 00000000 00000000 00000000 00000000 00000000 00000000
ffff8801373326c0 3542329796 S Bi:1:004:1 -115 13 <
ffff8801373326c0 3542329898 C Bi:1:004:1 0 13 = 55534253 9d000000 00000000 00
ffff8801373326c0 3542329954 S Bo:1:004:1 -115 31 = 55534243 9e000000 00020000 80000a28 00000001 1c000001 00000000 000000
ffff8801373326c0 3542330022 C Bo:1:004:1 0 31 >
ffff88013730bb40 3542330039 S Bi:1:004:1 -115 512 <
ffff88013730bb40 3542341774 C Bi:1:004:1 0 512 = 00000000 00000000 00000000 00000000 00000000 00000000 00000000 00000000
ffff8801373326c0 3542341794 S Bi:1:004:1 -115 13 <
ffff8801373326c0 3542341898 C Bi:1:004:1 0 13 = 55534253 9e000000 00000000 00
ffff8801373326c0 3542341955 S Bo:1:004:1 -115 31 = 55534243 9f000000 00020000 80000a28 00000001 1d000001 00000000 000000
ffff8801373326c0 3542342022 C Bo:1:004:1 0 31 >
ffff88008f6d2240 3542342039 S Bi:1:004:1 -115 512 <
ffff88008f6d2240 3542353403 C Bi:1:004:1 0 512 = 00000000 00000000 00000000 00000000 00000000 00000000 00000000 00000000
ffff8801373326c0 3542353419 S Bi:1:004:1 -115 13 <
ffff8801373326c0 3542353523 C Bi:1:004:1 0 13 = 55534253 9f000000 00000000 00
ffff8801373326c0 3542353585 S Bo:1:004:1 -115 31 = 55534243 a0000000 00020000 80000a28 00000001 1e000001 00000000 000000
ffff8801373326c0 3542353647 C Bo:1:004:1 0 31 >
ffff88013730bf00 3542353663 S Bi:1:004:1 -115 512 <
ffff88013730bf00 3542365023 C Bi:1:004:1 0 512 = 00000000 00000000 00000000 00000000 00000000 00000000 00000000 00000000
ffff8801373326c0 3542365043 S Bi:1:004:1 -115 13 <
ffff8801373326c0 3542365148 C Bi:1:004:1 0 13 = 55534253 a0000000 00000000 00
ffff8801373326c0 3542365204 S Bo:1:004:1 -115 31 = 55534243 a1000000 00020000 80000a28 00000001 1f000001 00000000 000000
ffff8801373326c0 3542365272 C Bo:1:004:1 0 31 >
ffff88013730bd80 3542365289 S Bi:1:004:1 -115 512 <
ffff88013730bd80 3542376773 C Bi:1:004:1 0 512 = 00000000 00000000 00000000 00000000 00000000 00000000 00000000 00000000
ffff8801373326c0 3542376795 S Bi:1:004:1 -115 13 <
ffff8801373326c0 3542376897 C Bi:1:004:1 0 13 = 55534253 a1000000 00000000 00
ffff8801373326c0 3542376962 S Bo:1:004:1 -115 31 = 55534243 a2000000 00020000 80000a28 00000001 20000001 00000000 000000
ffff8801373326c0 3542377022 C Bo:1:004:1 0 31 >
ffff88008f6d2c00 3542377038 S Bi:1:004:1 -115 512 <
ffff88008f6d2c00 3542388524 C Bi:1:004:1 0 512 = 00000000 00000000 00000000 00000000 00000000 00000000 00000000 00000000
ffff8801373326c0 3542388564 S Bi:1:004:1 -115 13 <
ffff8801373326c0 3542388648 C Bi:1:004:1 0 13 = 55534253 a2000000 00000000 00
ffff8801373326c0 3542389785 S Bo:1:004:1 -115 31 = 55534243 a3000000 00000000 00000600 00000000 00000000 00000000 000000
ffff8801373326c0 3542389898 C Bo:1:004:1 0 31 >
ffff8801373326c0 3542389924 S Bi:1:004:1 -115 13 <
ffff8801373326c0 3542390147 C Bi:1:004:1 0 13 = 55534253 a3000000 00000000 00
ffff8801373326c0 3542391890 S Bo:1:004:1 -115 31 = 55534243 a4000000 00000000 00000600 00000000 00000000 00000000 000000
ffff8801373326c0 3542392023 C Bo:1:004:1 0 31 >
ffff8801373326c0 3542392156 S Bi:1:004:1 -115 13 <
ffff8801373326c0 3542392273 C Bi:1:004:1 0 13 = 55534253 a4000000 00000000 00
ffff8801373326c0 3542506389 S Bo:1:004:1 -115 31 = 55534243 a5000000 00020000 80000a28 00000000 01000001 00000000 000000
ffff8801373326c0 3542506527 C Bo:1:004:1 0 31 >
ffff88009da98180 3542506544 S Bi:1:004:1 -115 512 <
ffff88009da98180 3542517403 C Bi:1:004:1 0 512 = f8ffffff 0000ffff 00000000 ffff0000 00000000 00000000 00000000 00000000
ffff8801373326c0 3542517424 S Bi:1:004:1 -115 13 <
ffff8801373326c0 3542517522 C Bi:1:004:1 0 13 = 55534253 a5000000 00000000 00
ffff8801373326c0 3542517585 S Bo:1:004:1 -115 31 = 55534243 a6000000 00020000 80000a28 00000000 02000001 00000000 000000
ffff8801373326c0 3542517647 C Bo:1:004:1 0 31 >
ffff88009da98180 3542517660 S Bi:1:004:1 -115 512 <
ffff88009da98180 3542528649 C Bi:1:004:1 0 512 = 00000000 00000000 00000000 00000000 00000000 00000000 00000000 00000000
ffff8801373326c0 3542528669 S Bi:1:004:1 -115 13 <
ffff8801373326c0 3542528773 C Bi:1:004:1 0 13 = 55534253 a6000000 00000000 00
ffff8801373326c0 3542528833 S Bo:1:004:1 -115 31 = 55534243 a7000000 00fc0000 80000a28 00000000 0300007e 00000000 000000
ffff8801373326c0 3542528897 C Bo:1:004:1 0 31 >
ffff88009da98180 3542528914 S Bi:1:004:1 -115 64512 <
ffff88009da98180 3542542651 C Bi:1:004:1 0 64512 = 00000000 00000000 00000000 00000000 00000000 00000000 00000000 00000000
ffff8801373326c0 3542542670 S Bi:1:004:1 -115 13 <
ffff8801373326c0 3542542898 C Bi:1:004:1 0 13 = 55534253 a7000000 00000000 00
ffff8801373326c0 3542665421 S Bo:1:004:1 -115 31 = 55534243 a8000000 00020000 80000a28 00000001 25000001 00000000 000000
ffff8801373326c0 3542665528 C Bo:1:004:1 0 31 >
ffff880135b62240 3542665542 S Bi:1:004:1 -115 512 <
ffff880135b62240 3542677280 C Bi:1:004:1 0 512 = 2e202020 20202020 20202010 00007601 81448144 00007601 81440300 00000000
ffff8801373326c0 3542677307 S Bi:1:004:1 -115 13 <
ffff8801373326c0 3542677398 C Bi:1:004:1 0 13 = 55534253 a8000000 00000000 00
ffff8801373326c0 3542677453 S Bo:1:004:1 -115 31 = 55534243 a9000000 00020000 80000a28 00000001 26000001 00000000 000000
ffff8801373326c0 3542677522 C Bo:1:004:1 0 31 >
ffff880135b620c0 3542677690 S Bi:1:004:1 -115 512 <
ffff880135b620c0 3542688783 C Bi:1:004:1 0 512 = 00000000 00000000 00000000 00000000 00000000 00000000 00000000 00000000
ffff8801373326c0 3542688813 S Bi:1:004:1 -115 13 <
ffff8801373326c0 3542688897 C Bi:1:004:1 0 13 = 55534253 a9000000 00000000 00
ffff8801373326c0 3542688953 S Bo:1:004:1 -115 31 = 55534243 aa000000 00040000 80000a28 00000001 27000002 00000000 000000
ffff8801373326c0 3542689022 C Bo:1:004:1 0 31 >
ffff88009d9dce40 3542689144 S Bi:1:004:1 -115 1024 <
ffff88009d9dce40 3542700529 C Bi:1:004:1 0 1024 = 00000000 00000000 00000000 00000000 00000000 00000000 00000000 00000000
ffff8801373326c0 3542700556 S Bi:1:004:1 -115 13 <
ffff8801373326c0 3542700647 C Bi:1:004:1 0 13 = 55534253 aa000000 00000000 00
ffff8801373326c0 3544711997 S Bo:1:004:1 -115 31 = 55534243 ab000000 00000000 00000600 00000000 00000000 00000000 000000
ffff8801373326c0 3544712151 C Bo:1:004:1 0 31 >
ffff8801373326c0 3544712172 S Bi:1:004:1 -115 13 <
ffff8801373326c0 3544712399 C Bi:1:004:1 0 13 = 55534253 ab000000 00000000 00
ffff8801373326c0 3546759995 S Bo:1:004:1 -115 31 = 55534243 ac000000 00000000 00000600 00000000 00000000 00000000 000000
ffff8801373326c0 3546760027 C Bo:1:004:1 0 31 >
ffff8801373326c0 3546760044 S Bi:1:004:1 -115 13 <
ffff8801373326c0 3546760398 C Bi:1:004:1 0 13 = 55534253 ac000000 00000000 00
ffff8801373326c0 3548807992 S Bo:1:004:1 -115 31 = 55534243 ad000000 00000000 00000600 00000000 00000000 00000000 000000
ffff8801373326c0 3548808027 C Bo:1:004:1 0 31 >
ffff8801373326c0 3548808044 S Bi:1:004:1 -115 13 <
ffff8801373326c0 3548808399 C Bi:1:004:1 0 13 = 55534253 ad000000 00000000 00
ffff8801373326c0 3550855995 S Bo:1:004:1 -115 31 = 55534243 ae000000 00000000 00000600 00000000 00000000 00000000 000000
ffff8801373326c0 3550856028 C Bo:1:004:1 0 31 >
ffff8801373326c0 3550856045 S Bi:1:004:1 -115 13 <
ffff8801373326c0 3550856400 C Bi:1:004:1 0 13 = 55534253 ae000000 00000000 00
ffff8801373326c0 3552903977 S Bo:1:004:1 -115 31 = 55534243 af000000 00000000 00000600 00000000 00000000 00000000 000000
ffff8801373326c0 3552904026 C Bo:1:004:1 0 31 >
ffff8801373326c0 3552904046 S Bi:1:004:1 -115 13 <
ffff8801373326c0 3552904400 C Bi:1:004:1 0 13 = 55534253 af000000 00000000 00
ffff8801373326c0 3554951977 S Bo:1:004:1 -115 31 = 55534243 b0000000 00000000 00000600 00000000 00000000 00000000 000000
ffff8801373326c0 3554952026 C Bo:1:004:1 0 31 >
ffff8801373326c0 3554952046 S Bi:1:004:1 -115 13 <
ffff8801373326c0 3554952401 C Bi:1:004:1 0 13 = 55534253 b0000000 00000000 00
ffff8801373326c0 3556999984 S Bo:1:004:1 -115 31 = 55534243 b1000000 00000000 00000600 00000000 00000000 00000000 000000
ffff8801373326c0 3557000028 C Bo:1:004:1 0 31 >
ffff8801373326c0 3557000044 S Bi:1:004:1 -115 13 <
ffff8801373326c0 3557000401 C Bi:1:004:1 0 13 = 55534253 b1000000 00000000 00
ffff8801373326c0 3559047978 S Bo:1:004:1 -115 31 = 55534243 b2000000 00000000 00000600 00000000 00000000 00000000 000000
ffff8801373326c0 3559048027 C Bo:1:004:1 0 31 >
ffff8801373326c0 3559048047 S Bi:1:004:1 -115 13 <
ffff8801373326c0 3559048276 C Bi:1:004:1 0 13 = 55534253 b2000000 00000000 00
ffff8801373326c0 3561095988 S Bo:1:004:1 -115 31 = 55534243 b3000000 00000000 00000600 00000000 00000000 00000000 000000
ffff8801373326c0 3561096032 C Bo:1:004:1 0 31 >
ffff8801373326c0 3561096050 S Bi:1:004:1 -115 13 <
ffff8801373326c0 3561096278 C Bi:1:004:1 0 13 = 55534253 b3000000 00000000 00
ffff8801373326c0 3563143979 S Bo:1:004:1 -115 31 = 55534243 b4000000 00000000 00000600 00000000 00000000 00000000 000000
ffff8801373326c0 3563144029 C Bo:1:004:1 0 31 >
ffff8801373326c0 3563144050 S Bi:1:004:1 -115 13 <
ffff8801373326c0 3563144278 C Bi:1:004:1 0 13 = 55534253 b4000000 00000000 00
ffff8801373326c0 3565191988 S Bo:1:004:1 -115 31 = 55534243 b5000000 00000000 00000600 00000000 00000000 00000000 000000
ffff8801373326c0 3565192031 C Bo:1:004:1 0 31 >
ffff8801373326c0 3565192051 S Bi:1:004:1 -115 13 <
ffff8801373326c0 3565192403 C Bi:1:004:1 0 13 = 55534253 b5000000 00000000 00
ffff8801373326c0 3567239980 S Bo:1:004:1 -115 31 = 55534243 b6000000 00000000 00000600 00000000 00000000 00000000 000000
ffff8801373326c0 3567240029 C Bo:1:004:1 0 31 >
ffff8801373326c0 3567240047 S Bi:1:004:1 -115 13 <
ffff8801373326c0 3567240403 C Bi:1:004:1 0 13 = 55534253 b6000000 00000000 00
ffff88013587f780 3567655666 C Ii:1:001:1 0:2048 2 = 2000
ffff88013587f780 3567655672 S Ii:1:001:1 -115:2048 4 <
ffff88008f713f00 3567655685 S Ci:1:001:0 s a3 00 0000 0005 0004 4 <
ffff88008f713f00 3567655701 C Ci:1:001:0 0 4 = 00010100
ffff88008f713f00 3567655707 S Co:1:001:0 s 23 01 0010 0005 0000 0
ffff88008f713f00 3567655712 C Co:1:001:0 0 0
ffff88008f676a80 3567661410 S Ci:1:001:0 s a3 00 0000 0005 0004 4 <
ffff88008f676a80 3567661419 C Ci:1:001:0 0 4 = 00010000
ffff88007d8fa900 3567691958 S Ci:1:001:0 s a3 00 0000 0005 0004 4 <
ffff88007d8fa900 3567691978 C Ci:1:001:0 0 4 = 00010000
ffff88007d8fab40 3567724001 S Ci:1:001:0 s a3 00 0000 0005 0004 4 <
ffff88007d8fab40 3567724015 C Ci:1:001:0 0 4 = 00010000
ffff88007d8fa480 3567755951 S Ci:1:001:0 s a3 00 0000 0005 0004 4 <
ffff88007d8fa480 3567755964 C Ci:1:001:0 0 4 = 00010000
ffff880135c550c0 3567787954 S Ci:1:001:0 s a3 00 0000 0005 0004 4 <
ffff880135c550c0 3567787983 C Ci:1:001:0 0 4 = 00010000
ffff88013587f780 3567788017 C Ii:1:001:1 -2:2048 0
